{
  "$schema": "http://json-schema.org/draft-07/schema#",
  "title": "Fun Detective Case",
  "description": "案件数据结构定义",
  "type": "object",
  "required": ["id", "基本信息", "故事视图", "设计视图", "元数据"],
  "properties": {
    "id": {
      "type": "string",
      "pattern": "^case-\\d{3}$"
    },
    "基本信息": {
      "type": "object",
      "required": ["案件名称", "来源类型", "地区", "一句话简介"],
      "properties": {
        "案件名称": {"type": "string", "minLength": 1},
        "来源类型": {"type": "string", "enum": ["推理小说", "真实案件", "影视", "游戏", "历史谜案", "其他"]},
        "来源作品/事件": {"type": "string"},
        "作者/创作者": {"type": "string"},
        "地区": {"type": "string", "enum": ["日本", "欧美", "中国", "其他"]},
        "年代": {"type": "string"},
        "案件状态": {"type": "string", "enum": ["已破案", "悬案", "虚构结局"]},
        "一句话简介": {"type": "string", "minLength": 1, "maxLength": 200},
        "参考链接": {
          "type": "array",
          "items": {
            "type": "object",
            "required": ["标题", "URL"],
            "properties": {
              "标题": {"type": "string"},
              "URL": {"type": "string", "format": "uri"},
              "类型": {"type": "string", "enum": ["维基百科", "百度百科", "豆瓣", "IMDb", "Steam", "B站", "官方网站", "其他"]}
            }
          }
        },
        "关联作品": {
          "type": "array",
          "items": {
            "type": "object",
            "required": ["作品名称", "作品类型", "关联关系"],
            "properties": {
              "作品名称": {"type": "string", "minLength": 1},
              "作品类型": {"type": "string", "enum": ["小说", "电影", "电视剧", "纪录片", "游戏", "动画", "漫画", "其他"]},
              "关联关系": {"type": "string", "enum": ["改编为", "改编自", "原型为", "衍生", "灵感来源", "同系列", "翻拍", "其他"]},
              "创作者": {"type": "string"},
              "年份": {"type": "integer", "minimum": 1800, "maximum": 2100},
              "简介": {"type": "string"},
              "站内Slug": {"type": "string"},
              "外部链接": {"type": "string", "format": "uri"}
            }
          }
        }
      }
    },
    "故事视图": {
      "type": "object",
      "properties": {
        "故事摘要": {"type": "string"},
        "完整故事": {"type": "string"},
        "人物关系": {"type": "string"},
        "关键时间线": {"type": "string"},
        "结局/真相": {"type": "string"},
        "角色档案": {
          "type": "array",
          "items": {
            "type": "object",
            "required": ["姓名"],
            "properties": {
              "姓名": {"type": "string"},
              "身份": {"type": "string"},
              "与案件关系": {"type": "string"},
              "动机": {"type": "string"},
              "关键行为": {"type": "string"}
            }
          }
        }
      }
    },
    "设计视图": {
      "type": "object",
      "properties": {
        "核心诡计简述": {"type": "string"},
        "诡计类型": {
          "type": "array",
          "items": {"type": "string", "enum": ["密室", "不在场证明", "叙述性诡计", "身份诡计", "心理操控", "时刻表", "物理机关", "毒杀", "其他"]}
        },
        "可复用机制": {
          "type": "array",
          "items": {"type": "string", "enum": ["封闭空间", "限时破案", "多视角叙事", "连环案件", "叙述者不可靠", "死亡信息", "其他"]}
        },
        "信息差分析": {"type": "string"},
        "红鲱鱼/误导": {"type": "string"},
        "难度评分": {
          "type": "object",
          "properties": {
            "线索密度": {"type": "number", "minimum": 1, "maximum": 5},
            "误导数量": {"type": "number", "minimum": 1, "maximum": 5},
            "诡计隐蔽度": {"type": "number", "minimum": 1, "maximum": 5},
            "综合": {"type": "number", "minimum": 1, "maximum": 5}
          }
        },
        "线索链": {
          "type": "array",
          "items": {
            "type": "object",
            "properties": {
              "线索编号": {"type": "string"},
              "线索内容": {"type": "string"},
              "线索类型": {"type": "string", "enum": ["关键线索", "误导线索", "背景信息"]},
              "指向结论": {"type": "string"},
              "出现时机": {"type": "string", "enum": ["开篇", "前期", "中期", "后期", "终局"]}
            }
          }
        }
      }
    },
    "游戏设计": {
      "type": "object",
      "properties": {
        "游戏平台": {"type": "array", "items": {"type": "string"}},
        "玩法类型": {"type": "array", "items": {"type": "string"}},
        "核心玩法机制": {"type": "array", "items": {"type": "string"}},
        "关卡结构": {"type": "string"},
        "玩家引导方式": {"type": "string"},
        "推理系统设计": {"type": "string"},
        "可复用游戏模板": {"type": "array", "items": {"type": "string"}}
      }
    },
    "元数据": {
      "type": "object",
      "required": ["录入状态", "录入日期", "最后更新"],
      "properties": {
        "录入状态": {"type": "string", "enum": ["完整", "草稿", "待审核", "待录入", "故事完成", "设计完成", "初稿", "已完成"]},
        "录入日期": {"type": "string", "pattern": "^\\d{4}-\\d{2}-\\d{2}$"},
        "最后更新": {"type": "string", "pattern": "^\\d{4}-\\d{2}-\\d{2}$"},
        "飞书记录ID": {"type": "string"},
        "版本": {"type": "integer", "minimum": 1}
      }
    }
  }
}
