{
  "id": "case-100",
  "基本信息": {
    "案件名称": "理查德·拉米雷斯案",
    "来源类型": "真实案件",
    "来源作品/事件": "1984-1985年夜行者",
    "作者/创作者": "",
    "地区": "欧美",
    "年代": "20世纪80年代",
    "案件状态": "已破案",
    "一句话简介": "拉米雷斯自称'夜行者'，崇拜撒旦，在洛杉矶犯下13起谋杀，随机选择受害者，1985年被市民认出围捕，2013年病死狱中。",
    "参考链接": [
      {
        "标题": "维基百科 - 理查德·拉米雷斯案",
        "URL": "https://zh.wikipedia.org/wiki/理查德·拉米雷斯案",
        "类型": "维基百科"
      },
      {
        "标题": "百度百科 - 理查德·拉米雷斯案",
        "URL": "https://baike.baidu.com/item/%E7%90%86%E6%9F%A5%E5%BE%B7%C2%B7%E6%8B%89%E7%B1%B3%E9%9B%B7%E6%96%AF%E6%A1%88",
        "类型": "百度百科"
      }
    ],
    "推荐视频": [
      {
        "标题": "B站搜索 - 理查德·拉米雷斯案 纪录片",
        "URL": "https://search.bilibili.com/all?keyword=%E7%90%86%E6%9F%A5%E5%BE%B7%C2%B7%E6%8B%89%E7%B1%B3%E9%9B%B7%E6%96%AF%E6%A1%88%20%E7%BA%AA%E5%BD%95%E7%89%87",
        "来源": "B站",
        "视频类型": "纪录片",
        "简介": "搜索理查德·拉米雷斯案相关的纪录片、案件分析和深度调查视频"
      },
      {
        "标题": "YouTube搜索 - 理查德·拉米雷斯案",
        "URL": "https://www.youtube.com/results?search_query=%E7%90%86%E6%9F%A5%E5%BE%B7%C2%B7%E6%8B%89%E7%B1%B3%E9%9B%B7%E6%96%AF%E6%A1%88",
        "来源": "YouTube",
        "视频类型": "纪录片",
        "简介": "Search YouTube for videos related to 理查德·拉米雷斯案"
      }
    ],
    "发表年份": 1984,
    "大洲": "其他"
  },
  "故事视图": {
    "故事摘要": "拉米雷斯自称'夜行者'，崇拜撒旦，在洛杉矶犯下13起谋杀，随机选择受害者，1985年被市民认出围捕，2013年病死狱中。",
    "完整故事": "理查德·拉米雷斯1984-1985年在洛杉矶和旧金山犯下13起谋杀、多起强奸抢劫，自称'夜行者'，崇拜撒旦，在现场留下倒五角星标志。他随机选择受害者（通过未锁门窗潜入），受害者年龄从9岁到83岁不等，让整个洛杉矶陷入恐慌。1985年8月他偷车后回到洛杉矶，被便利店顾客认出（照片刚在电视播出），试图逃跑时被市民围殴后被捕。他在法庭上举起手展示手掌上的倒五角星，大喊'撒旦万岁'。1989年被判死刑，在死囚牢房待了24年，2013年6月7日因肝功能衰竭在医院去世，死时53岁，最终未被执行死刑。",
    "人物关系": "理查德·拉米雷斯（夜行者/凶手）- 13名受害者 - 洛杉矶市民",
    "关键时间线": "1984年第一起谋杀 / 1984-1985年共13起谋杀 / 留下倒五角星标志 / 1985年洛杉矶陷入恐慌 / 偷车后被市民认出围捕 / 1989年被判死刑 / 2013年病死狱中",
    "角色档案": [
      {
        "姓名": "理查德·拉米雷斯",
        "身份": "流浪汉/撒旦崇拜者/夜行者",
        "与案件关系": "真凶",
        "动机": "撒旦崇拜+虐待狂",
        "关键行为": "犯下13起谋杀，被市民围捕，2013年病死狱中"
      },
      {
        "姓名": "受害者们",
        "身份": "13人被杀/多人被强奸抢劫",
        "与案件关系": "受害者",
        "动机": "无",
        "关键行为": "被深夜潜入家中杀害"
      },
      {
        "姓名": "洛杉矶市民",
        "身份": "普通市民",
        "与案件关系": "抓捕者",
        "动机": "保护社区",
        "关键行为": "认出拉米雷斯并围殴他，协助警方逮捕"
      }
    ],
    "结局": "凶手是理查德·拉米雷斯，流浪汉和撒旦崇拜者。他在1984-1985年犯下13起谋杀、多起强奸抢劫，自称'夜行者'，在现场留下倒五角星标志。他随机选择受害者，让整个洛杉矶陷入恐慌。1985年被市民认出围捕后被捕，1989年被判死刑，在死囚牢房待了24年，2013年因肝功能衰竭去世，最终未被执行死刑。"
  },
  "设计视图": {
    "核心诡计简述": "随机作案+撒旦崇拜+媒体抓捕：没有固定目标和作案模式，利用人们对家的安全感作案，撒旦崇拜制造超自然恐惧，最终被媒体和市民抓住。案件展示了媒体在抓捕连环杀手中的作用和社区自助的重要性。",
    "诡计类型": [
      "心理操控",
      "其他"
    ],
    "可复用机制": [
      "连环案件",
      "多视角叙事"
    ],
    "信息差分析": "凶手的随机作案模式和撒旦崇拜身份是关键信息差。拉米雷斯没有固定的受害者人群、没有固定的作案模式、没有固定的住所，这使得警方很难追踪他。他的撒旦崇拜和倒五角星标志让案件看起来像是超自然的邪教犯罪，而不是一个普通流浪汉的随机暴力。",
    "红鲱鱼/误导": "撒旦崇拜和倒五角星标志是最大红鲱鱼，让警方以为凶手是邪教成员或精神病人，而不是一个普通的流浪汉。随机选择受害者也让警方难以建立受害者之间的联系。",
    "难度评分": {
      "线索密度": 3,
      "误导数量": 4,
      "诡计隐蔽度": 4,
      "综合": 3.7
    },
    "线索链": [
      {
        "线索编号": "C01",
        "线索内容": "犯罪现场都有倒五角星标志",
        "线索类型": "关键线索",
        "指向结论": "案件核心模式",
        "出现时机": "前期"
      },
      {
        "线索编号": "C02",
        "线索内容": "凶手通过未锁门窗潜入家中",
        "线索类型": "关键线索",
        "指向结论": "指向真凶",
        "出现时机": "中期"
      },
      {
        "线索编号": "C03",
        "线索内容": "受害者年龄从9岁到83岁不等",
        "线索类型": "误导线索",
        "指向结论": "转移注意力",
        "出现时机": "中期"
      },
      {
        "线索编号": "C04",
        "线索内容": "媒体发布凶手的模拟画像和照片",
        "线索类型": "关键线索",
        "指向结论": "关键突破",
        "出现时机": "后期"
      },
      {
        "线索编号": "C05",
        "线索内容": "便利店顾客认出拉米雷斯，市民围殴后被捕",
        "线索类型": "关键线索",
        "指向结论": "真相揭露",
        "出现时机": "终局"
      }
    ]
  },
  "游戏设计": {},
  "元数据": {
    "录入状态": "故事完成",
    "录入日期": "2026-08-31",
    "最后更新": "2026-08-31",
    "飞书记录ID": "",
    "版本": 1
  }
}