{
  "id": "case-018",
  "基本信息": {
    "案件名称": "十角馆事件",
    "来源类型": "推理小说",
    "来源作品/事件": "十角馆事件",
    "作者/创作者": "",
    "地区": "日本",
    "年代": "近现代（1900-1980）",
    "案件状态": "已破案",
    "一句话简介": "推理社团成员在十角馆度假，接连被杀，凶手利用双身份和摩托艇在岛与本土之间穿梭。",
    "参考链接": [
      {
        "标题": "维基百科 - 十角馆事件",
        "URL": "https://zh.wikipedia.org/wiki/十角馆事件",
        "类型": "维基百科"
      },
      {
        "标题": "豆瓣 - 十角馆事件",
        "URL": "https://book.douban.com/subject/1079998/",
        "类型": "豆瓣"
      }
    ],
    "大洲": "亚洲",
    "推荐视频": [
      {
        "标题": "B站搜索 - 《十角馆事件》作品解说",
        "URL": "https://search.bilibili.com/all?keyword=%E5%8D%81%E8%A7%92%E9%A6%86%E4%BA%8B%E4%BB%B6%20%E8%A7%A3%E8%AF%B4",
        "来源": "B站",
        "视频类型": "解说",
        "简介": "搜索《十角馆事件》相关的作品解读、剧情分析和作者介绍视频"
      }
    ],
    "发表年份": 1987,
    "关联作品": [
      {
        "作品名称": "十角馆杀人预告",
        "作品类型": "小说",
        "关联关系": "同系列",
        "创作者": "绫辻行人",
        "简介": "绫辻行人馆系列作品",
        "站内Slug": "推理小说/日本/十角馆杀人预告"
      },
      {
        "作品名称": "钟表馆事件",
        "作品类型": "小说",
        "关联关系": "同系列",
        "创作者": "绫辻行人",
        "简介": "绫辻行人馆系列作品",
        "站内Slug": "推理小说/日本/钟表馆事件"
      },
      {
        "作品名称": "钟表馆幽灵",
        "作品类型": "小说",
        "关联关系": "同系列",
        "创作者": "绫辻行人",
        "简介": "绫辻行人馆系列作品",
        "站内Slug": "推理小说/日本/钟表馆幽灵"
      },
      {
        "作品名称": "迷宫馆事件",
        "作品类型": "小说",
        "关联关系": "同系列",
        "创作者": "绫辻行人",
        "简介": "绫辻行人馆系列作品",
        "站内Slug": "推理小说/日本/迷宫馆事件"
      },
      {
        "作品名称": "人偶馆事件",
        "作品类型": "小说",
        "关联关系": "同系列",
        "创作者": "绫辻行人",
        "简介": "绫辻行人馆系列作品",
        "站内Slug": "推理小说/日本/人偶馆事件"
      },
      {
        "作品名称": "暗黑馆事件",
        "作品类型": "小说",
        "关联关系": "同系列",
        "创作者": "绫辻行人",
        "简介": "绫辻行人馆系列作品",
        "站内Slug": "推理小说/日本/暗黑馆事件"
      },
      {
        "作品名称": "黑猫馆事件",
        "作品类型": "小说",
        "关联关系": "同系列",
        "创作者": "绫辻行人",
        "简介": "绫辻行人馆系列作品",
        "站内Slug": "推理小说/日本/黑猫馆事件"
      }
    ]
  },
  "故事视图": {
    "故事摘要": "K大学推理社团的七名成员来到角岛的十角馆度假。当晚，成员奥希兹被杀，随后几天里，成员接连死亡。岛田洁在本土调查，发现凶手是社团成员之一，他利用十角馆和本土之间的距离，用摩托艇来回穿梭，制造岛上只有七人的假象。",
    "完整故事": "K大学推理社团的七名成员——埃勒里、范达因、爱伦坡、勒胡、卡尔、阿加莎、奥希兹——来到角岛的十角馆度假。十角馆是中村青司设计的建筑，半年前这里发生过一起大火，烧死了建筑师中村青司和他的妻子。\n\n第一晚，奥希兹在房间中被勒死，手上的戒指不见了。第二天早上，众人发现奥希兹的尸体，陷入恐慌。他们试图用无线电求救，但无线电被破坏，无法联系外界。\n\n接下来的几天里，成员接连被杀：阿加莎被毒死（口红里有毒），卡尔被毒死（咖啡里有毒），勒胡被砸死，爱伦坡被毒死（香烟里有毒）。最后只剩下埃勒里和范达因。\n\n与此同时，岛田洁在本土调查角岛的旧案。他发现，半年前的火灾中，中村青司的弟弟中村红次郎有不在场证明，但有一个人被忽略了——推理社团的成员范达因，他的真名是中村慎太郎，是中村青司的弟弟。\n\n岛田洁推理出真相：范达因（中村慎太郎）是凶手。他因为哥哥青司和嫂子和枝的死而怀恨在心，策划了这场复仇。他利用十角馆和本土之间的距离，用摩托艇在夜间来回穿梭。白天他在岛上，晚上他偷偷回到本土，出现在朋友面前，制造我一直在本土的不在场证明。\n\n范达因在岛上杀人，同时在本土制造不在场证明，让所有人都以为岛上的七个人中不可能有人是凶手。他还利用十角馆的十个房间和机关，隐藏自己的行踪。\n\n最后，埃勒里发现了真相，但被范达因杀死。范达因在十角馆中放火，然后消失。岛田洁最终找到了范达因，但范达因已经自杀，留下了一封自白信，讲述了整个复仇计划。",
    "人物关系": "范达因/中村慎太郎（凶手）- 其他六名社团成员（受害者）- 岛田洁（侦探）- 中村青司（核心人物/已死）",
    "关键时间线": "半年前：角岛火灾，中村青司死亡；度假第一天：七人到达十角馆，奥希兹被杀；数日内：多人接连被杀；最后：岛田洁揭示真相，范达因自杀",
    "角色档案": [
      {
        "姓名": "岛田洁",
        "身份": "推理作家，侦探",
        "与案件关系": "案件侦破者",
        "动机": "对中村青司建筑的兴趣",
        "关键行为": "通过本土调查和摩托艇线索识破双身份诡计"
      },
      {
        "姓名": "范达因/中村慎太郎",
        "身份": "推理社团成员，中村青司的弟弟",
        "与案件关系": "凶手",
        "动机": "为哥哥青司复仇",
        "关键行为": "用摩托艇在岛与本土间穿梭，制造不在场证明，杀死六名成员后自杀"
      },
      {
        "姓名": "埃勒里",
        "身份": "推理社团成员",
        "与案件关系": "最后一名受害者",
        "动机": "无",
        "关键行为": "发现真相后被范达因杀死"
      },
      {
        "姓名": "中村青司",
        "身份": "建筑师，十角馆设计者",
        "与案件关系": "核心人物（已死）",
        "动机": "无",
        "关键行为": "半年前在火灾中死亡，成为复仇的源头"
      }
    ],
    "结局": "凶手是范达因（中村慎太郎），他利用摩托艇在岛与本土之间穿梭，制造不在场证明。动机是为哥哥复仇。最后他自杀，留下自白信。"
  },
  "设计视图": {
    "核心诡计简述": "新本格推理的开山之作，核心是无人生还模式的变体——凶手在岛上杀人的同时，用摩托艇夜间回到本土制造不在场证明。利用岛上只有七人的思维定式，让所有人以为凶手在死人中，实际上凶手一直在活人中。",
    "诡计类型": [
      "不在场证明",
      "身份诡计",
      "心理操控"
    ],
    "可复用机制": [
      "封闭空间",
      "连环案件",
      "多视角叙事"
    ],
    "信息差分析": "岛上的人以为只有七个人，不知道凶手可以夜间离开；本土的人以为范达因一直在本土，不知道他夜间去岛上杀人；两边的信息差构成了诡计的基础。",
    "红鲱鱼/误导": "十角馆的机关、中村青司的幽灵、半年前的火灾，都营造了超自然氛围；成员之间的互相猜忌转移了对范达因的注意。",
    "难度评分": {
      "线索密度": 4,
      "误导数量": 4.5,
      "诡计隐蔽度": 4.5,
      "综合": 4.3
    },
    "线索链": [
      {
        "线索编号": "C01",
        "线索内容": "角岛十角馆曾发生中村青司一家被杀的惨案",
        "线索类型": "背景信息",
        "指向结论": "孤岛与过去的案件形成心理暗示",
        "出现时机": "开篇"
      },
      {
        "线索编号": "C02",
        "线索内容": "K大学推理研究会七名成员前往十角馆度假",
        "线索类型": "背景信息",
        "指向结论": "凶手就在这七人之中",
        "出现时机": "开篇"
      },
      {
        "线索编号": "C03",
        "线索内容": "到达当晚，发现写着'第一位被害者'等的预告牌",
        "线索类型": "关键线索",
        "指向结论": "凶手提前准备了杀人计划",
        "出现时机": "前期"
      },
      {
        "线索编号": "C04",
        "线索内容": "奥希兹被勒死在房间，房间从内部上锁",
        "线索类型": "关键线索",
        "指向结论": "密室是利用十角馆的特殊结构制造的",
        "出现时机": "前期"
      },
      {
        "线索编号": "C05",
        "线索内容": "卡尔被毒杀，咖啡中混入氰化物",
        "线索类型": "关键线索",
        "指向结论": "凶手可以接触到所有人的食物和饮品",
        "出现时机": "中期"
      },
      {
        "线索编号": "C06",
        "线索内容": "阿加莎在睡梦中被毒杀，口红上有毒",
        "线索类型": "关键线索",
        "指向结论": "凶手了解每个人的生活习惯",
        "出现时机": "中期"
      },
      {
        "线索编号": "C07",
        "线索内容": "勒鲁被石块砸死在馆外",
        "线索类型": "关键线索",
        "指向结论": "凶手趁人外出时单独行动",
        "出现时机": "中期"
      },
      {
        "线索编号": "C08",
        "线索内容": "爱伦·坡被毒杀，烟斗中混入毒物",
        "线索类型": "关键线索",
        "指向结论": "凶手对每个人的私人物品都有接触机会",
        "出现时机": "后期"
      },
      {
        "线索编号": "C09",
        "线索内容": "范·达因'生病'留在房间，很少出现",
        "线索类型": "关键线索",
        "指向结论": "范利用生病作为掩护，实际在执行杀人计划",
        "出现时机": "后期"
      },
      {
        "线索编号": "C10",
        "线索内容": "最后剩下的艾勒里和卡，卡被发现'死亡'",
        "线索类型": "误导线索",
        "指向结论": "卡的死是假死，真凶是范",
        "出现时机": "后期"
      },
      {
        "线索编号": "C11",
        "线索内容": "十角馆的房间布局有秘密通道或机关",
        "线索类型": "关键线索",
        "指向结论": "中村青司设计的建筑本身就是杀人诡计的一部分",
        "出现时机": "后期"
      },
      {
        "线索编号": "C12",
        "线索内容": "守须（范·达因）在本土的不在场证明被打破",
        "线索类型": "关键线索",
        "指向结论": "范利用橡皮艇往返本土和角岛，制造不在场证明",
        "出现时机": "终局"
      },
      {
        "线索编号": "C13",
        "线索内容": "艾勒里发现真相后选择自杀，十角馆被烧毁",
        "线索类型": "关键线索",
        "指向结论": "叙述性诡计：范·达因就是守须，双线叙事最终汇合",
        "出现时机": "终局"
      }
    ]
  },
  "游戏设计": {
    "游戏平台": [],
    "玩法类型": [],
    "核心玩法机制": [],
    "关卡结构": "",
    "玩家引导方式": "",
    "推理系统设计": "",
    "可复用游戏模板": []
  },
  "元数据": {
    "录入状态": "故事完成",
    "录入日期": "2026-08-30",
    "最后更新": "2026-08-30",
    "飞书记录ID": "recvtKoyR6QF2R",
    "版本": 1
  }
}
