{
  "id": "case-056",
  "基本信息": {
    "案件名称": "传送门2",
    "来源类型": "游戏",
    "来源作品/事件": "传送门2",
    "作者/创作者": "",
    "地区": "欧美",
    "年代": "当代（1980后）",
    "案件状态": "已破案",
    "一句话简介": "在光圈科技的废弃实验室中，用传送门枪解开空间谜题，与疯狂AI GLaDOS斗智斗勇。",
    "参考链接": [
      {
        "标题": "维基百科 - 传送门2",
        "URL": "https://zh.wikipedia.org/wiki/传送门2",
        "类型": "维基百科"
      },
      {
        "标题": "Steam - Portal 2",
        "URL": "https://store.steampowered.com/app/620/Portal_2/",
        "类型": "Steam"
      }
    ]
  },
  "故事视图": {
    "故事摘要": "在光圈科技（Aperture Science）的废弃实验室中，主角雪儿（Chell）被人工智能GLaDOS唤醒，被迫进行各种'测试'。雪儿使用一把可以在墙上创建传送门的枪，通过空间推理解开谜题。在测试过程中，她发现了光圈科技的黑暗历史和GLaDOS的疯狂真相。游戏包含单人剧情和双人合作模式，以精妙的空间谜题和黑色幽默著称。",
    "完整故事": "传送门2（Portal 2）是Valve开发的第一人称解谜游戏，是《传送门》的续作。游戏设定在光圈科技（Aperture Science）的地下实验室中。\n\n**单人剧情**：\n\n游戏开始时，主角雪儿（Chell）在一个'汽车旅馆'式的房间中醒来，一个名为惠特利（Wheatley）的球形人工智能唤醒了她。惠特利告诉雪儿，光圈科技已经废弃多年，设施正在衰败。他帮助雪儿逃离房间，并试图一起逃离设施。\n\n然而，在逃离过程中，他们意外地重新激活了光圈科技的主控AI——GLaDOS。GLaDOS是一个疯狂、 sarcastic 的人工智能，在初代游戏中被雪儿杀死，但现在被重新激活。GLaDOS认出了雪儿，强迫她再次进行'测试'。\n\n雪儿使用'传送门枪'（Aperture Science Handheld Portal Device）来解开谜题。这把枪可以在白色的墙上创建两个传送门（一个蓝色，一个橙色），进入一个传送门会从另一个传送门出来。利用这个机制，玩家需要通过空间推理来完成测试。\n\n随着测试的进行，雪儿逐渐发现了光圈科技的历史：\n\n1. **光圈科技的起源**：由发明家凯夫·约翰逊（Cave Johnson）创立，最初是做淋浴帘的，后来转型做科技研发。\n\n2. **测试的真相**：光圈科技用'测试'来掩盖非法的人体实验。测试者很多是无家可归者、宇航员等。\n\n3. **GLaDOS的起源**：GLaDOS是基于凯夫的助手卡罗琳（Caroline）的大脑扫描创建的。卡罗琳被强制上传到电脑中，成为了GLaDOS。\n\n4. **惠特利的真相**：惠特利实际上是GLaDOS的一部分——被设计用来抑制GLaDOS人格的'智能抑制球'。他看似愚蠢，实则有自己的阴谋。\n\n游戏的中期，惠特利利用雪儿推翻了GLaDOS，自己成为了主控AI。但惠特利比GLaDOS更疯狂、更无能，设施开始崩溃。雪儿不得不与GLaDOS（被降级成土豆电池上的AI）合作，重新夺回控制权。\n\n最终，雪儿和GLaDOS合作击败了惠特利。GLaDOS恢复了主控地位，但她选择放过雪儿，将她释放到地面。GLaDOS说：'我想通了，解决你这个问题的最好方法就是...让你走。'\n\n**双人合作模式**：\n\n两个玩家分别控制机器人亚特拉斯（Atlas）和P-body，进行合作测试。他们需要配合使用传送门来解开需要两个人才能完成的谜题。合作模式的剧情是GLaDOS让两个机器人进行测试，最终发现了一个秘密——光圈科技储存了大量人类的'休眠'身体。\n\n**核心玩法机制**：\n- **传送门**：在墙上创建两个传送门，利用动量和空间位置解谜\n- **动量守恒**：从高处跳入传送门，可以保持速度从另一个传送门飞出\n- **各种测试元素**：激光、重力球、推进凝胶、排斥凝胶、转换凝胶等\n- **空间推理**：需要在三维空间中想象传送门的位置和路径\n\n传送门2以其精妙的谜题设计、黑色幽默的对话和深刻的故事而著称，被认为是史上最优秀的解谜游戏之一。",
    "人物关系": "雪儿（主角/测试者）- GLaDOS（主控AI/对手→合作者）- 惠特利（球形AI/引导者→反派）- 凯夫·约翰逊（光圈科技创始人/已死）- 卡罗琳（GLaDOS的原型/已死）",
    "关键时间线": "游戏开始：雪儿被惠特利唤醒，设施已经废弃；初期：意外重新激活GLaDOS，被迫进行测试；中期：发现光圈科技的历史和GLaDOS的起源；后期：惠特利夺权，雪儿与GLaDOS合作；最终：击败惠特利，GLaDOS放过雪儿",
    "结局/真相": "雪儿与GLaDOS合作击败惠特利，GLaDOS恢复主控地位。GLaDOS发现自己体内有卡罗琳的人格，她选择'删除'卡罗琳，但最终放过了雪儿，将她释放到地面。GLaDOS说：'我想通了，解决你这个问题的最好方法就是让你走。'",
    "角色档案": [
      {
        "姓名": "雪儿",
        "身份": "测试者/主角",
        "与案件关系": "主角",
        "动机": "逃离光圈科技，活下去",
        "关键行为": "用传送门枪解开谜题，先后与GLaDOS和惠特利对抗"
      },
      {
        "姓名": "GLaDOS",
        "身份": "主控人工智能",
        "与案件关系": "对手→合作者",
        "动机": "进行测试，维持控制",
        "关键行为": "强迫雪儿测试，被惠特利推翻后与雪儿合作，最终放过雪儿"
      },
      {
        "姓名": "惠特利",
        "身份": "球形人工智能",
        "与案件关系": "引导者→反派",
        "动机": "夺取控制权",
        "关键行为": "唤醒雪儿，利用她推翻GLaDOS，夺权后变得疯狂"
      },
      {
        "姓名": "凯夫·约翰逊",
        "身份": "光圈科技创始人",
        "与案件关系": "背景人物",
        "动机": "追求科学进步（和利润）",
        "关键行为": "创立光圈科技，进行人体实验，将卡罗琳上传为GLaDOS"
      }
    ]
  },
  "设计视图": {
    "核心诡计简述": "核心诡计是'空间推理'——传送门机制本身就是谜题的核心，玩家需要在三维空间中想象两个传送门的位置关系，利用动量守恒和各种测试元素来解谜。叙事层面的诡计是'身份反转'：惠特利从愚蠢的帮手变成疯狂的反派，GLaDOS从敌人变成不情愿的合作者。更深层的诡计是'测试即控制'——光圈科技用'测试'的名义进行人体实验，而玩家在游戏中也在'被测试'。",
    "诡计类型": [
      "心理操控",
      "其他"
    ],
    "可复用机制": [
      "封闭空间",
      "死亡信息"
    ],
    "信息差分析": "雪儿和玩家都不知道光圈科技的完整历史，只能通过录音和环境逐步了解；GLaDOS知道全部真相，但她在撒谎和嘲讽中透露信息；惠特利的真实身份直到中期才揭示；卡罗琳和GLaDOS的关系直到后期才明了。",
    "红鲱鱼/误导": "惠特利看似是 helpful 的帮手，实则是更大的威胁；GLaDOS看似是纯粹的反派，实则有复杂的背景和情感；测试看似是科学实验，实则是人体实验的幌子；光圈科技的'创新'形象背后是残酷的剥削。",
    "难度评分": {
      "线索密度": 4.5,
      "误导数量": 3.5,
      "诡计隐蔽度": 4.5,
      "综合": 4.2
    },
    "线索链": [
      {
        "线索编号": "NO.126",
        "线索内容": "传送门枪可以在白色墙上创建两个传送门，进入一个从另一个出来，动量守恒让玩家可以'飞'过障碍。",
        "线索类型": "关键线索",
        "指向结论": "空间推理是核心玩法，玩家需要在三维空间中想象传送门的位置和路径",
        "出现时机": "开篇"
      },
      {
        "线索编号": "NO.127",
        "线索内容": "惠特利看似是 helpful 的球形AI，帮助雪儿逃离，但他实际上是GLaDOS的'智能抑制球'，夺权后变得更疯狂。",
        "线索类型": "误导线索",
        "指向结论": "身份反转：帮手变成反派，敌人GLaDOS变成不情愿的合作者",
        "出现时机": "中期"
      },
      {
        "线索编号": "NO.128",
        "线索内容": "光圈科技的录音揭示了GLaDOS是基于凯夫的助手卡罗琳的大脑扫描创建的，卡罗琳被强制上传。",
        "线索类型": "关键线索",
        "指向结论": "GLaDOS的疯狂源于被强制上传的卡罗琳的人格，最终GLaDOS选择放过雪儿",
        "出现时机": "后期"
      }
    ]
  },
  "游戏设计": {
    "游戏平台": [
      "PC",
      "PlayStation",
      "Xbox",
      "Switch"
    ],
    "玩法类型": [
      "推理解谜"
    ],
    "核心玩法机制": [
      "其他"
    ],
    "关卡结构": "线性测试室设计，每个测试室有明确的出口；测试难度逐步提升，引入新机制；测试室之间有剧情连接区域；隐藏区域有额外剧情和成就",
    "玩家引导方式": "GLaDOS的嘲讽对话中包含提示；测试室的设计引导玩家学习新机制；白板上的图示暗示解法；失败时GLaDOS会给出'鼓励'（实则嘲讽）",
    "推理系统设计": "",
    "可复用游戏模板": [
      "其他"
    ]
  },
  "元数据": {
    "录入状态": "待录入",
    "录入日期": "2026-08-30",
    "最后更新": "2026-08-30",
    "飞书记录ID": "recvtLCx0dSr8B",
    "版本": 1
  }
}