{
  "id": "case-044",
  "基本信息": {
    "案件名称": "极限脱出",
    "来源类型": "游戏",
    "来源作品/事件": "极限脱出：9小时9个人9之门",
    "作者/创作者": "",
    "地区": "日本",
    "年代": "当代（1980后）",
    "案件状态": "已破案",
    "一句话简介": "9个人被困在一艘沉没的船上，必须在9小时内解开9扇门的谜题，否则会被淹死，真相比想象的更复杂。",
    "参考链接": [
      {
        "标题": "维基百科 - 极限脱出",
        "URL": "https://zh.wikipedia.org/wiki/极限脱出",
        "类型": "维基百科"
      },
      {
        "标题": "豆瓣 - 极限脱出：9小时9个人9之门",
        "URL": "https://movie.douban.com/subject/25754096/",
        "类型": "豆瓣"
      }
    ],
    "大洲": "亚洲",
    "推荐视频": [
      {
        "标题": "B站搜索 - 《极限脱出》游戏实况",
        "URL": "https://search.bilibili.com/all?keyword=%E6%9E%81%E9%99%90%E8%84%B1%E5%87%BA%20%E5%AE%9E%E5%86%B5",
        "来源": "B站",
        "视频类型": "实况",
        "简介": "搜索《极限脱出》相关的游戏实况、攻略流程和评测视频"
      }
    ],
    "发表年份": 2009,
    "关联作品": [
      {
        "作品名称": "9小时9个人9扇门",
        "作品类型": "游戏",
        "关联关系": "同系列",
        "创作者": "打越钢太郎",
        "简介": "极限脱出系列作品",
        "站内Slug": "游戏/日本/9小时9个人9扇门"
      },
      {
        "作品名称": "极限脱出2：善人死亡",
        "作品类型": "游戏",
        "关联关系": "同系列",
        "创作者": "打越钢太郎",
        "简介": "极限脱出系列作品",
        "站内Slug": "游戏/日本/极限脱出2：善人死亡"
      },
      {
        "作品名称": "极限脱出ADV：善人死亡",
        "作品类型": "游戏",
        "关联关系": "同系列",
        "创作者": "打越钢太郎",
        "简介": "极限脱出系列作品",
        "站内Slug": "游戏/日本/极限脱出ADV：善人死亡"
      },
      {
        "作品名称": "极限脱出：9小时9个人9扇门",
        "作品类型": "游戏",
        "关联关系": "同系列",
        "创作者": "打越钢太郎",
        "简介": "极限脱出系列作品",
        "站内Slug": "游戏/日本/极限脱出：9小时9个人9扇门"
      }
    ]
  },
  "故事视图": {
    "故事摘要": "9个人被绑架到一艘正在沉没的船上，手腕上戴着数字手表。一个自称'零'的人告诉他们：必须在9小时内解开9扇门的谜题，找到9号门逃生，否则船会沉没。每个人的手表上有一个数字，通过门需要数字之和的数字根等于门的号码。主角淳平（Junpei）在逃生过程中发现，这不是简单的逃生游戏，而是一个关于'形态形成场'理论、兄妹分离和复仇的复杂计划。最终揭示，零就是其中一个参与者，整个游戏是为了让特定的人激活形态形成场能力，拯救一个女孩。",
    "完整故事": "大学生淳平（Junpei）醒来时发现自己在一艘正在沉没的船上的船舱里。他逃到大厅，发现还有8个人：紫（Kubota，淳平的青梅竹马）、一宫（Ichimiya，CEO）、双一（Futaki，医生）、四叶（Yotsuba，女孩）、尼尔斯（Nils，失明的天才少年）、赛文（Seven，刑警）、八代（Yotsuya，程序员）和九（Kyu，男孩）。\n\n一个自称'零'的人通过广播告诉他们规则：\n1. 他们必须在9小时内找到9号门逃生；\n2. 船上有9扇编号门，通过门需要3-5人，他们手表数字之和的数字根必须等于门的号码；\n3. 通过门后，门会永久关闭，没通过的人无法再通过；\n4. 船会在9小时后沉没。\n\n在逃生过程中，他们发现了船上的秘密：这艘船与9年前的一次实验有关。9年前，一个名为'形态形成场'的实验在这艘船上进行，实验对象是一对兄妹——尼尔斯和他的妹妹茜（Akane）。实验目的是测试人类是否能通过'形态形成场'（一种集体意识场）传递信息。实验中，茜被困在焚烧炉中，尼尔斯通过形态形成场向未来传递信息，拯救了她。\n\n淳平逐渐发现，紫实际上就是茜——她在9年前的实验中'死亡'，但实际上通过形态形成场与未来的淳平建立了联系，一直存在于'现在'。整个游戏是茜（零）策划的，目的是让淳平在特定的时刻激活形态形成场能力，向9年前的茜传递信息，拯救她。\n\n游戏有多个结局，取决于玩家的选择。在真结局中，淳平解开了所有谜题，激活了形态形成场，向9年前的茜传递了信息，拯救了她。9个人都成功逃生。茜（紫）在最后消失，因为她的存在依赖于形态形成场的连接。\n\n游戏的核心设定'形态形成场'理论（基于鲁珀特·谢尔德雷克（Rupert Sheldrake）的理论）贯穿始终，探讨了意识、时间和命运的主题。",
    "人物关系": "淳平（主角/大学生）- 紫/茜（青梅竹马/零/策划者）- 尼尔斯（天才少年/茜的哥哥）- 一宫（CEO/凶手）- 赛文（刑警/9年前的调查者）- 其他参与者",
    "关键时间线": "9年前：形态形成场实验，茜被困焚烧炉，尼尔斯传递信息；现在：9人被绑架到船上，开始9小时逃生游戏；游戏中：逐步揭示9年前的真相；真结局：淳平激活形态形成场，拯救茜，9人逃生",
    "结局/真相": "零就是茜（紫），整个游戏是她策划的，目的是让淳平激活形态形成场，向9年前的她传递信息拯救她。一宫是9年前实验的参与者，也是船上的杀人凶手。9人最终逃生，茜消失。",
    "角色档案": [
      {
        "姓名": "淳平",
        "身份": "大学生，主角",
        "与案件关系": "主角/关键人物",
        "动机": "逃生，保护紫",
        "关键行为": "解开所有谜题，激活形态形成场，向9年前的茜传递信息"
      },
      {
        "姓名": "紫/茜",
        "身份": "淳平的青梅竹马/零/策划者",
        "与案件关系": "策划者",
        "动机": "拯救9年前的自己",
        "关键行为": "策划整个9小时逃生游戏，以紫的身份参与，最终消失"
      },
      {
        "姓名": "尼尔斯",
        "身份": "失明的天才少年，茜的哥哥",
        "与案件关系": "关键人物",
        "动机": "寻找妹妹",
        "关键行为": "9年前通过形态形成场传递信息，现在参与游戏寻找真相"
      },
      {
        "姓名": "一宫",
        "身份": "CEO",
        "与案件关系": "杀人凶手",
        "动机": "掩盖9年前实验的罪行",
        "关键行为": "在船上杀害其他参与者，最终被揭穿"
      }
    ]
  },
  "设计视图": {
    "核心诡计简述": "核心诡计是'时间循环'和'身份隐藏'——茜在9年前'死亡'，但通过形态形成场与未来建立联系，以'紫'的身份存在于现在，并策划了整个游戏。诡计利用了'形态形成场'这一科幻设定，让'未来影响过去'成为可能。数字根谜题既是逃生机制，也是叙事诡计的一部分。",
    "诡计类型": [
      "身份诡计",
      "叙述性诡计",
      "心理操控"
    ],
    "可复用机制": [
      "封闭空间",
      "限时破案",
      "多视角叙事",
      "死亡信息"
    ],
    "信息差分析": "玩家和淳平都不知道零的真实身份，也不知道9年前实验的真相；每个人都有自己的秘密和动机；形态形成场设定让'时间是非线性的'这一信息被隐藏到最后；多结局结构让玩家需要多次游玩才能拼凑完整真相。",
    "红鲱鱼/误导": "一宫的'CEO'身份和冷漠态度让他看似是幕后黑手，实际上他只是9年前实验的参与者和船上的杀人凶手；数字根谜题看似只是逃生机制，实际上隐藏了身份线索；茜的'死亡'是最大的烟雾弹。",
    "难度评分": {
      "线索密度": 4.5,
      "误导数量": 5,
      "诡计隐蔽度": 5,
      "综合": 4.8
    },
    "线索链": [
      {
        "线索编号": "NO.093",
        "线索内容": "9个人被困在一艘沉没的船上，每个人手腕上都有一个数字手表，他们需要通过数字根为9的门才能逃脱。",
        "线索类型": "背景信息",
        "指向结论": "数字根规则是整个游戏的核心，它决定了团队的分组和行动路线",
        "出现时机": "开篇"
      },
      {
        "线索编号": "NO.094",
        "线索内容": "第一个受害者是一个代号为'0号'的人，他的尸体在焚化炉中被发现，手表也被拿走了。",
        "线索类型": "关键线索",
        "指向结论": "0号并没有死，他是整个游戏的策划者，利用假死来监视其他参与者",
        "出现时机": "中期"
      },
      {
        "线索编号": "NO.095",
        "线索内容": "主角淳平发现自己有能力看到不同时间线的未来，他利用这种能力找到了真正的逃脱路线。",
        "线索类型": "关键线索",
        "指向结论": "整个游戏是一个时间循环实验，淳平的能力是实验的一部分，最终他打破了循环救出了所有人",
        "出现时机": "终局"
      }
    ]
  },
  "游戏设计": {
    "游戏平台": [
      "电脑",
      "PlayStation",
      " Switch主机主机"
    ],
    "玩法类型": [
      "文字冒险",
      "推理解谜"
    ],
    "核心玩法机制": [
      "证据收集",
      "时间回溯",
      "环境探查",
      "线索拼接",
      "对话选择"
    ],
    "关卡结构": "9人被困在封闭空间，通过数字根规则分组进入不同房间。每个房间是一个密室逃脱关卡，需要解谜才能逃脱。通过流程图系统可以回溯到之前的选择点，探索不同分支。多条路线的信息拼凑后才能揭开最终真相。",
    "玩家引导方式": "数字根规则在游戏开始时详细说明；密室中有'提示'功能（消耗时间）；流程图显示已探索和未探索的分支；关键道具会自动记录在物品栏。",
    "推理系统设计": "",
    "可复用游戏模板": [
      "搜查推理",
      "时间线重构",
      "推理拼图",
      "对话分支"
    ]
  },
  "元数据": {
    "录入状态": "待录入",
    "录入日期": "2026-08-30",
    "最后更新": "2026-08-30",
    "飞书记录ID": "recvtL4dbtu24s",
    "版本": 1
  }
}