{
  "id": "case-059",
  "基本信息": {
    "案件名称": "阳光下的罪恶",
    "来源类型": "推理小说",
    "来源作品/事件": "阿加莎·克里斯蒂作品",
    "作者/创作者": "阿加莎·克里斯蒂",
    "地区": "欧美",
    "年代": "黄金时代（1920-1950）",
    "案件状态": "已破案",
    "一句话简介": "海岛度假胜地发生谋杀，美艳女演员在沙滩上被掐死，所有人都有不在场证明。",
    "参考链接": [
      {
        "标题": "维基百科 - 阳光下的罪恶",
        "URL": "https://zh.wikipedia.org/wiki/阳光下的罪恶",
        "类型": "维基百科"
      },
      {
        "标题": "豆瓣读书 - 搜索《阳光下的罪恶》",
        "URL": "https://search.douban.com/book/subject_search?search_text=%E9%98%B3%E5%85%89%E4%B8%8B%E7%9A%84%E7%BD%AA%E6%81%B6",
        "类型": "豆瓣"
      }
    ],
    "推荐视频": [
      {
        "标题": "B站搜索 - 《阳光下的罪恶》作品解说",
        "URL": "https://search.bilibili.com/all?keyword=%E9%98%B3%E5%85%89%E4%B8%8B%E7%9A%84%E7%BD%AA%E6%81%B6%20%E8%A7%A3%E8%AF%B4",
        "来源": "B站",
        "视频类型": "解说",
        "简介": "搜索《阳光下的罪恶》相关的作品解读、剧情分析和作者介绍视频"
      },
      {
        "标题": "YouTube搜索 - 阳光下的罪恶",
        "URL": "https://www.youtube.com/results?search_query=%E9%98%B3%E5%85%89%E4%B8%8B%E7%9A%84%E7%BD%AA%E6%81%B6",
        "来源": "YouTube",
        "视频类型": "解说",
        "简介": "Search YouTube for videos related to 阳光下的罪恶"
      }
    ],
    "发表年份": 1941,
    "大洲": "其他"
  },
  "故事视图": {
    "故事摘要": "海岛度假胜地发生谋杀，美艳女演员在沙滩上被掐死，所有人都有不在场证明。",
    "完整故事": "美丽的女演员阿琳娜·马歇尔与丈夫肯尼斯、继女琳达来到走私者海湾度假。阿琳娜生性风流，与年轻的帕特里克·雷德芬关系暧昧，引得帕特里克的妻子克里斯蒂娜郁郁寡欢。度假村里还有酷爱运动的布鲁斯特小姐、作家雷克斯·布鲁斯特、霍勒斯·布拉特爵士等人。\n\n一天上午，阿琳娜独自划船去了海湾另一侧的僻静沙滩。中午时分，帕特里克和布鲁斯特小姐划船经过时，发现阿琳娜躺在沙滩上，似乎在晒太阳。帕特里克上岸查看，惊呼阿琳娜已死。警方调查发现阿琳娜是被掐死的，死亡时间在上午10点到12点之间。\n\n然而几乎所有人都有不在场证明：肯尼斯在房间写信，琳达和克里斯蒂娜在海边游泳后去画画，霍勒斯在和阿琳娜谈生意后离开，雷克斯在岛上散步。波洛逐一排查，发现了时间线上的微妙矛盾。\n\n真相是帕特里克和克里斯蒂娜合谋杀人。克里斯蒂娜伪装成阿琳娜躺在沙滩上（用棕色化妆品和假发），让帕特里克和布鲁斯特小姐误以为发现了尸体。帕特里克上岸后假装查看，实际上此时真的阿琳娜被藏在附近的洞穴中。等布鲁斯特小姐离开去报警后，帕特里克才掐死真正的阿琳娜。克里斯蒂娜则利用琳达的手表制造了时间错觉——她提前把琳达的表拨快了20分钟，让琳达为自己提供不在场证明。动机是帕特里克骗取了阿琳娜的大量钱财，阿琳娜发现真相后威胁要揭发，两人遂起杀心。",
    "人物关系": "波洛（侦探）- 阿琳娜（受害者）- 肯尼斯（丈夫）- 琳达（继女）- 帕特里克（情人/凶手）- 克里斯蒂娜（帕特里克妻子/共犯）",
    "关键时间线": "阿琳娜与帕特里克暧昧关系公开 / 案发当日上午阿琳娜独自去僻静沙滩 / 帕特里克与布鲁斯特发现'尸体' / 警方调查不在场证明 / 波洛发现手表时间矛盾 / 洞穴中发现棕色化妆品 / 帕特里克与克里斯蒂娜合谋真相暴露",
    "角色档案": [
      {
        "姓名": "阿琳娜·马歇尔",
        "身份": "美艳女演员",
        "与案件关系": "受害者",
        "动机": "无",
        "关键行为": "被情人帕特里克杀害"
      },
      {
        "姓名": "帕特里克·雷德芬",
        "身份": "年轻英俊的男子",
        "与案件关系": "凶手",
        "动机": "掩盖骗取钱财的事实",
        "关键行为": "与妻子合谋，假装发现尸体后杀人"
      },
      {
        "姓名": "克里斯蒂娜·雷德芬",
        "身份": "帕特里克的妻子",
        "与案件关系": "共犯",
        "动机": "协助丈夫",
        "关键行为": "伪装尸体、拨快手表制造不在场证明"
      },
      {
        "姓名": "琳达·马歇尔",
        "身份": "阿琳娜的继女",
        "与案件关系": "被利用者",
        "动机": "无",
        "关键行为": "手表被拨快，无意中提供了虚假不在场证明"
      },
      {
        "姓名": "赫尔克里·波洛",
        "身份": "比利时侦探",
        "与案件关系": "案件侦破者",
        "动机": "追求真相",
        "关键行为": "识破时间诡计和尸体调包"
      }
    ],
    "结局": "凶手是帕特里克·雷德芬，妻子克里斯蒂娜为共犯。两人利用尸体调包和手表拨快的时间诡计制造不在场证明，动机是帕特里克骗取阿琳娜钱财后杀人灭口。"
  },
  "设计视图": {
    "核心诡计简述": "双重不在场证明诡计：1）尸体调包——妻子伪装成死者躺在沙滩上，让第三者误以为死亡时间提前；2）时间误导——拨快证人的手表，制造关键时间差。",
    "诡计类型": [
      "不在场证明",
      "身份诡计",
      "心理操控"
    ],
    "可复用机制": [
      "封闭空间",
      "限时破案"
    ],
    "信息差分析": "关键信息差在于死亡时间的判定。所有人都以为尸体在中午被发现时已经死亡，但实际上那是伪装的尸体，真正的谋杀发生在发现之后。手表被拨快进一步混淆了时间线。",
    "红鲱鱼/误导": "阿琳娜的风流韵事让多人都有嫌疑——丈夫肯尼斯的嫉妒、继女琳达的怨恨、被抛弃的情人，这些都转移了对帕特里克夫妇的关注。",
    "难度评分": {
      "线索密度": 4,
      "误导数量": 3,
      "诡计隐蔽度": 4,
      "综合": 3.7
    },
    "线索链": [
      {
        "线索编号": "C01",
        "线索内容": "发现尸体时布鲁斯特小姐没有靠近查看",
        "线索类型": "关键线索",
        "指向结论": "尸体可能是伪装的",
        "出现时机": "前期"
      },
      {
        "线索编号": "C02",
        "线索内容": "琳达的手表比实际时间快20分钟",
        "线索类型": "关键线索",
        "指向结论": "时间被人为拨快",
        "出现时机": "中期"
      },
      {
        "线索编号": "C03",
        "线索内容": "克里斯蒂娜说自己恐高却出现在悬崖上",
        "线索类型": "关键线索",
        "指向结论": "克里斯蒂娜在说谎",
        "出现时机": "中期"
      },
      {
        "线索编号": "C04",
        "线索内容": "洞穴中发现棕色化妆品瓶子",
        "线索类型": "关键线索",
        "指向结论": "有人伪装成阿琳娜",
        "出现时机": "后期"
      },
      {
        "线索编号": "C05",
        "线索内容": "帕特里克在发现'尸体'时支开布鲁斯特",
        "线索类型": "关键线索",
        "指向结论": "帕特里克有作案时间",
        "出现时机": "后期"
      },
      {
        "线索编号": "C06",
        "线索内容": "阿琳娜近期大额资金异常",
        "线索类型": "背景信息",
        "指向结论": "可能涉及金钱纠纷",
        "出现时机": "前期"
      }
    ]
  },
  "游戏设计": {},
  "元数据": {
    "录入状态": "故事完成",
    "录入日期": "2026-08-31",
    "最后更新": "2026-08-31",
    "飞书记录ID": "",
    "版本": 1
  }
}