{
  "id": "case-077",
  "基本信息": {
    "案件名称": "布朗神父探案集",
    "来源类型": "推理小说",
    "来源作品/事件": "G.K.切斯特顿作品",
    "作者/创作者": "G.K.切斯特顿",
    "地区": "欧美",
    "年代": "黄金时代（1920-1950）",
    "案件状态": "已破案",
    "一句话简介": "一位身材矮小、其貌不扬的天主教神父，凭借对人性的深刻理解，破解了一个个看似不可能的犯罪。",
    "参考链接": [
      {
        "标题": "维基百科 - 布朗神父探案集",
        "URL": "https://zh.wikipedia.org/wiki/布朗神父探案集",
        "类型": "维基百科"
      },
      {
        "标题": "豆瓣读书 - 搜索《布朗神父探案集》",
        "URL": "https://search.douban.com/book/subject_search?search_text=%E5%B8%83%E6%9C%97%E7%A5%9E%E7%88%B6%E6%8E%A2%E6%A1%88%E9%9B%86",
        "类型": "豆瓣"
      }
    ],
    "推荐视频": [
      {
        "标题": "B站搜索 - 《布朗神父探案集》作品解说",
        "URL": "https://search.bilibili.com/all?keyword=%E5%B8%83%E6%9C%97%E7%A5%9E%E7%88%B6%E6%8E%A2%E6%A1%88%E9%9B%86%20%E8%A7%A3%E8%AF%B4",
        "来源": "B站",
        "视频类型": "解说",
        "简介": "搜索《布朗神父探案集》相关的作品解读、剧情分析和作者介绍视频"
      },
      {
        "标题": "YouTube搜索 - 布朗神父探案集",
        "URL": "https://www.youtube.com/results?search_query=%E5%B8%83%E6%9C%97%E7%A5%9E%E7%88%B6%E6%8E%A2%E6%A1%88%E9%9B%86",
        "来源": "YouTube",
        "视频类型": "解说",
        "简介": "Search YouTube for videos related to 布朗神父探案集"
      }
    ],
    "发表年份": 1911,
    "大洲": "其他"
  },
  "故事视图": {
    "故事摘要": "一位身材矮小、其貌不扬的天主教神父，凭借对人性的深刻理解，破解了一个个看似不可能的犯罪。",
    "完整故事": "布朗神父是一位天主教神父，他身材矮小、圆脸、衣着朴素，总是带着一把大雨伞，看起来毫不起眼。但他有着极其敏锐的观察力和对人性的深刻理解——他在忏悔室里听过无数人的罪，因此对人类的罪恶和欺骗有着超乎常人的洞察。他经常说：'我是一个神父，我研究人。'\n\n布朗神父的案件通常是短篇故事，每个故事都有一个独特的谜题。以下是几个经典案例的概要：\n\n1.《蓝宝石十字架》：布朗神父在火车上遇到一个高大的牧师，对方声称要保护一颗珍贵的蓝宝石十字架。布朗神父通过对方的一系列小细节（他的包裹方式、他对祈祷的态度、他的手）发现这个人是假牧师，实际上是著名的大盗弗拉莫。布朗神父用计让弗拉莫暴露，并最终感化了他（弗拉莫后来成为了布朗神父的朋友和侦探搭档）。\n\n2.《隐身人》：一个公寓楼里发生了谋杀案，门卫声称没有人进出过公寓。布朗神父发现凶手是一个邮递员——他利用了人们对'穿制服的人'的视而不见，邮递员在所有人眼中是'隐形'的，因为人们不会把穿制服的人当作'访客'来注意。\n\n3.《断剑》：一位将军在战场上被自己人杀死，他的墓碑上刻着'为国王和国家而死'。布朗神父通过将军断剑的细节和战场上的奇怪部署，发现将军是因为发现了下属的叛国行为而被灭口。这个故事探讨了'历史是由胜利者书写的'主题。\n\n4.《狗的启示》：一个人在密室中被杀死，唯一的目击者是一条狗。布朗神父通过狗没有叫这个细节，推断出凶手是狗认识的人（一个熟人），而不是外来者。\n\n5.《天主的锤子》：一个人被人用锤子砸死在自己的书房里，凶器不见了。布朗神父发现凶手就是死者的双胞胎兄弟，他利用了两人长得一模一样的特点，在杀人后伪装成死者出现在众人面前，制造了死亡时间的假象。\n\n布朗神父的推理方法与福尔摩斯不同——他不依赖物证和科学，而是依赖对人性的理解。他经常说：'要理解一个罪犯，你必须成为一个罪犯。'他通过想象自己是凶手，来推断凶手会怎么做。他的案件经常涉及'看似不可能'的犯罪，但答案往往简单而深刻——它们揭示了人性中的贪婪、嫉妒、骄傲和欺骗。\n\n布朗神父系列对后世推理小说产生了深远影响，尤其是在'心理推理'和'不可能犯罪'领域。G.K.切斯特顿创造的这个形象，证明了侦探不一定需要是超人或科学家，一个理解人性的普通人也能成为伟大的侦探。",
    "人物关系": "布朗神父（侦探）- 弗拉莫（大盗/后来的搭档）- 各种受害者和凶手",
    "关键时间线": "多个短篇故事，每个都有独立的案件和推理",
    "角色档案": [
      {
        "姓名": "布朗神父",
        "身份": "天主教神父",
        "与案件关系": "侦探",
        "动机": "理解人性+追求真相",
        "关键行为": "通过对人性的洞察破解不可能犯罪"
      },
      {
        "姓名": "弗拉莫",
        "身份": "大盗/后来的侦探",
        "与案件关系": "搭档/朋友",
        "动机": "被布朗神父感化",
        "关键行为": "从大盗变成布朗神父的助手和朋友"
      },
      {
        "姓名": "各种凶手",
        "身份": "短篇故事中的罪犯",
        "与案件关系": "凶手",
        "动机": "人性的弱点",
        "关键行为": "每个故事都有不同的凶手和动机"
      }
    ],
    "结局": "布朗神父系列是短篇推理小说集，每个故事都有独立的真相。核心主题是：最不可能的人往往是凶手，最明显的线索往往被忽略，人性的弱点是一切犯罪的根源。"
  },
  "设计视图": {
    "核心诡计简述": "心理推理+不可能犯罪诡计：布朗神父的核心'诡计'不是物理机关，而是心理盲点——人们对穿制服的人视而不见、对熟人不设防、对显而易见的事实忽略、对'不可能'的假设不加质疑。每个短篇都揭示了一种人类认知的盲点，凶手正是利用了这些盲点来犯罪。",
    "诡计类型": [
      "密室",
      "叙述性诡计",
      "心理操控",
      "身份诡计",
      "其他"
    ],
    "可复用机制": [
      "封闭空间",
      "多视角叙事"
    ],
    "信息差分析": "信息差在于人们的认知盲点。布朗神父能看到其他人看不到的东西，不是因为他更聪明，而是因为他不假设——他不假设穿制服的人不是访客、不假设狗不叫是因为没有外人、不假设双胞胎不会互换身份。他对人性的理解让他能够进入凶手的思维，看到被其他人忽略的线索。",
    "红鲱鱼/误导": "最大的红鲱鱼是'不可能'本身——每个案件看起来都是不可能犯罪（没有凶手进出、凶器消失、死者在密室中被杀），这种'不可能'让人们放弃了理性思考，转向超自然解释。布朗神父的贡献就是打破'不可能'的假设，找到简单而合理的答案。",
    "难度评分": {
      "线索密度": 4,
      "误导数量": 4,
      "诡计隐蔽度": 4,
      "综合": 4
    },
    "线索链": [
      {
        "线索编号": "C01",
        "线索内容": "门卫说没有人进出，但邮递员进出了",
        "线索类型": "关键线索",
        "指向结论": "穿制服的人被视而不见",
        "出现时机": "前期"
      },
      {
        "线索编号": "C02",
        "线索内容": "狗在案发时没有叫",
        "线索类型": "关键线索",
        "指向结论": "凶手是熟人",
        "出现时机": "中期"
      },
      {
        "线索编号": "C03",
        "线索内容": "假牧师的包裹方式和祈祷姿势不对",
        "线索类型": "关键线索",
        "指向结论": "他不是真牧师",
        "出现时机": "前期"
      },
      {
        "线索编号": "C04",
        "线索内容": "将军的剑断了",
        "线索类型": "关键线索",
        "指向结论": "将军在战斗中发现了什么",
        "出现时机": "中期"
      },
      {
        "线索编号": "C05",
        "线索内容": "双胞胎兄弟长得一模一样",
        "线索类型": "关键线索",
        "指向结论": "身份互换可能",
        "出现时机": "后期"
      },
      {
        "线索编号": "C06",
        "线索内容": "凶器消失了但房间里有一个大锤",
        "线索类型": "关键线索",
        "指向结论": "凶器就是房间里的东西",
        "出现时机": "后期"
      }
    ]
  },
  "游戏设计": {},
  "元数据": {
    "录入状态": "故事完成",
    "录入日期": "2026-08-31",
    "最后更新": "2026-08-31",
    "飞书记录ID": "",
    "版本": 1
  }
}