{
  "id": "case-043",
  "基本信息": {
    "案件名称": "弹丸论破",
    "来源类型": "游戏",
    "来源作品/事件": "弹丸论破：希望的学园与绝望的高中生",
    "作者/创作者": "",
    "地区": "日本",
    "年代": "当代（1980后）",
    "案件状态": "已破案",
    "一句话简介": "15名超高校级学生被困在希望峰学园，黑白熊强迫他们互相残杀，只有在学级裁判中找出凶手才能毕业。",
    "参考链接": [
      {
        "标题": "维基百科 - 弹丸论破",
        "URL": "https://zh.wikipedia.org/wiki/弹丸论破",
        "类型": "维基百科"
      },
      {
        "标题": "豆瓣 - 弹丸论破",
        "URL": "https://movie.douban.com/subject/25724808/",
        "类型": "豆瓣"
      }
    ],
    "大洲": "亚洲",
    "推荐视频": [
      {
        "标题": "B站搜索 - 《弹丸论破》游戏实况",
        "URL": "https://search.bilibili.com/all?keyword=%E5%BC%B9%E4%B8%B8%E8%AE%BA%E7%A0%B4%20%E5%AE%9E%E5%86%B5",
        "来源": "B站",
        "视频类型": "实况",
        "简介": "搜索《弹丸论破》相关的游戏实况、攻略流程和评测视频"
      }
    ],
    "发表年份": 2010,
    "关联作品": [
      {
        "作品名称": "弹丸论破2：再见绝望学园",
        "作品类型": "游戏",
        "关联关系": "同系列",
        "创作者": "Spike Chunsoft",
        "简介": "弹丸论破系列作品",
        "站内Slug": "游戏/日本/弹丸论破2：再见绝望学园"
      },
      {
        "作品名称": "弹丸论破V3",
        "作品类型": "游戏",
        "关联关系": "同系列",
        "创作者": "Spike Chunsoft",
        "简介": "弹丸论破系列作品",
        "站内Slug": "游戏/日本/弹丸论破V3"
      }
    ]
  },
  "故事视图": {
    "故事摘要": "15名拥有'超高校级'才能的高中生被困在希望峰学园中。一只自称'校长'的黑白熊告诉他们：想要毕业，就必须杀死一个同学，并且在随后的'学级裁判'中不被发现。如果凶手被找出，凶手被处刑；如果凶手没被找出，除凶手外的所有人被处刑。主角苗木诚（超高校级的幸运）在一系列杀人事件中，通过学级裁判找出了每个案件的真凶，最终发现了整个事件的幕后黑手——超高校级的绝望江之岛盾子，以及'人类史上最大最恶的绝望事件'的真相。",
    "完整故事": "希望峰学园是一所培养天才的学校，只有拥有'超高校级'才能的学生才能入学。15名新生入学后，发现自己被困在学园中，所有出口都被封锁。一只黑白相间的玩偶熊'黑白熊'出现，自称校长，宣布了'毕业规则'：\n\n1. 想要毕业，就必须杀死一个同学；\n2. 杀人后会进行'学级裁判'，所有人讨论并投票选出凶手；\n3. 如果选出正确的凶手，凶手被处刑，其他人继续；\n4. 如果选错了，凶手毕业，其他人全部被处刑。\n\n游戏包含6个章节（6起杀人事件）：\n\n1. 第一章：舞园沙耶香（超高校级的偶像）被杀害。凶手是桑田怜恩（超高校级的棒球选手）。舞园试图嫁祸苗木，但被桑田反杀。\n\n2. 第二章：大和田纹土（超高校级的暴走族）杀害了不二咲千寻（超高校级的程序员）。大和田因为嫉妒不二咲的勇气而杀人。\n\n3. 第三章：山田一二三（超高校级的同人作家）和石丸清多夏（超高校级的风纪委员）被杀害。凶手是塞蕾丝缇雅（超高校级的赌徒），她策划了复杂的杀人计划，想要获得100亿日元奖金。\n\n4. 第四章：大神樱（超高校级的格斗家）被发现死亡。最初以为是他杀，最终揭示是自杀。大神是黑白熊的内奸，她为了保护同伴而自杀，并留下了揭露幕后黑手的线索。\n\n5. 第五章：雾切响子（超高校级的侦探）被指控杀害了战刃骸（超高校级的佣兵）。苗木诚为雾切辩护，发现战刃骸实际上是江之岛盾子的双胞胎姐姐，被盾子杀害。\n\n6. 第六章（最终章）：苗木诚和雾切响子发现了整个事件的真相。希望峰学园实际上是一个'人类史上最大最恶的绝望事件'的发生地。江之岛盾子（超高校级的绝望）策划了这一切，她想要让全世界陷入绝望。战刃骸是她的同谋，但被盾子杀害。\n\n在最终的学级裁判中，苗木诚用'希望'击败了盾子的'绝望'。盾子自愿接受处刑（包含所有之前的处刑方式）。苗木诚、雾切响子、腐川冬子、叶隐康比吕、朝日奈葵和十神白夜六人幸存，打开了学园的大门，走向了外面的世界。",
    "人物关系": "苗木诚（主角/超高校级的幸运→希望）- 雾切响子（侦探/助手）- 江之岛盾子（幕后黑手/超高校级的绝望）- 黑白熊（执行者）- 15名超高校级学生",
    "关键时间线": "入学：15名学生被困，黑白熊宣布规则；第一章：舞园被杀，桑田是凶手；第二章：大和田杀害不二咲；第三章：塞蕾丝杀害山田和石丸；第四章：大神自杀；第五章：战刃骸被杀，雾切被指控；最终章：揭示江之岛盾子的阴谋，六人幸存毕业",
    "角色档案": [
      {
        "姓名": "苗木诚",
        "身份": "超高校级的幸运→超高校级的希望",
        "与案件关系": "主角",
        "动机": "保护同伴，寻找真相",
        "关键行为": "在学级裁判中找出所有真凶，最终用希望击败绝望"
      },
      {
        "姓名": "雾切响子",
        "身份": "超高校级的侦探",
        "与案件关系": "助手/关键人物",
        "动机": "调查父亲的死亡和学园的秘密",
        "关键行为": "引导苗木发现真相，最终章被指控但被苗木解救"
      },
      {
        "姓名": "江之岛盾子",
        "身份": "超高校级的绝望，幕后黑手",
        "与案件关系": "凶手/策划者",
        "动机": "让全世界陷入绝望",
        "关键行为": "策划自相残杀游戏，伪装成战刃骸，杀害姐姐，最终自愿处刑"
      },
      {
        "姓名": "黑白熊",
        "身份": "学园校长，盾子的执行者",
        "与案件关系": "执行者",
        "动机": "执行盾子的计划",
        "关键行为": "宣布规则，主持学级裁判，处刑凶手"
      }
    ],
    "结局": "江之岛盾子是幕后黑手，她策划了整个自相残杀游戏，目的是让全世界陷入绝望。战刃骸是她的同谋和双胞胎姐姐，被她杀害。苗木诚用希望击败绝望，六人幸存。"
  },
  "设计视图": {
    "核心诡计简述": "核心诡计是'身份交换'和'幕后黑手隐藏'——江之岛盾子伪装成战刃骸混入学生中，战刃骸伪装成盾子被杀害，制造了'幕后黑手已死'的假象。学级裁判的规则本身也是诡计：通过互相残杀和猜疑，让希望变成绝望。",
    "诡计类型": [
      "身份诡计",
      "心理操控",
      "叙述性诡计"
    ],
    "可复用机制": [
      "封闭空间",
      "连环案件",
      "限时破案",
      "多视角叙事"
    ],
    "信息差分析": "玩家和学生都不知道幕后黑手是谁，也不知道学园外面的世界发生了什么；黑白熊的规则限制了信息流通；每个案件的凶手都利用了学级裁判的规则来隐藏自己；江之岛盾子的身份交换是最大的信息差。",
    "红鲱鱼/误导": "大神樱的'内奸'身份看似是最大的背叛，实际上她是为了保护同伴；战刃骸的'死亡'看似结束了幕后黑手的威胁，实际上是盾子的计划；每个案件的'明显嫌疑人'往往不是真凶。",
    "难度评分": {
      "线索密度": 4.5,
      "误导数量": 5,
      "诡计隐蔽度": 5,
      "综合": 4.8
    },
    "线索链": [
      {
        "线索编号": "NO.090",
        "线索内容": "学生们被困在希望峰学园，黑白熊宣布只有杀人并逃脱惩罚才能毕业，第一个受害者是舞园沙耶香。",
        "线索类型": "背景信息",
        "指向结论": "黑白熊的规则是整个游戏的核心，它利用学生的恐惧和欲望制造杀人动机",
        "出现时机": "开篇"
      },
      {
        "线索编号": "NO.091",
        "线索内容": "舞园沙耶香在浴室中被刺杀，现场的淋浴间门把手上有被告苗木诚的指纹，但淋浴间的门锁是坏的。",
        "线索类型": "误导线索",
        "指向结论": "指纹是苗木诚之前留下的，真正的凶手利用了坏掉的门锁进入淋浴间",
        "出现时机": "前期"
      },
      {
        "线索编号": "NO.092",
        "线索内容": "凶手桑田怜恩的工具盒里发现了一把玻璃球，与现场的玻璃碎片完全吻合，他的校服上也有受害者的血迹。",
        "线索类型": "关键线索",
        "指向结论": "桑田怜恩是凶手，他用玻璃球砸坏门锁进入淋浴间，杀死舞园后试图嫁祸苗木诚",
        "出现时机": "终局"
      }
    ]
  },
  "游戏设计": {
    "游戏平台": [
      "电脑",
      "PlayStation",
      " Xbox主机",
      " Switch主机主机",
      "手机"
    ],
    "玩法类型": [
      "文字冒险",
      "推理解谜"
    ],
    "核心玩法机制": [
      "证据收集",
      "矛盾指证",
      "对话选择",
      "线索拼接",
      "其他"
    ],
    "关卡结构": "每章分为日常篇（与角色互动、收集信息）和非日常篇（发现尸体、调查取证），然后进入学级裁判。学级裁判包含不间断讨论、机关枪辩论、逻辑深潜、灵光乍现组字等多种玩法环节，最终投票选出凶手。",
    "玩家引导方式": "黑白熊的规则说明引导游戏流程；调查时发光的物品提示可互动；学级裁判中'思考时间'暂停让玩家整理思路；言弹系统可视化证据与证词的矛盾点。",
    "推理系统设计": "",
    "可复用游戏模板": [
      "法庭对决",
      "推理拼图",
      "嫌疑人档案",
      "对话分支"
    ]
  },
  "元数据": {
    "录入状态": "待录入",
    "录入日期": "2026-08-30",
    "最后更新": "2026-08-30",
    "飞书记录ID": "recvtL4dbtvrY8",
    "版本": 1
  }
}
