{
  "id": "case-087",
  "基本信息": {
    "案件名称": "所罗门的伪证",
    "来源类型": "推理小说",
    "来源作品/事件": "宫部美雪作品",
    "作者/创作者": "宫部美雪",
    "地区": "日本",
    "年代": "社会派（1980-至今）",
    "案件状态": "已破案",
    "一句话简介": "中学生在圣诞节早晨发现同学坠楼身亡，警方判定为自杀。但一封告密信指控这是谋杀，于是学生们决定自己组织一场校内审判来查明真相。",
    "参考链接": [
      {
        "标题": "维基百科 - 所罗门的伪证",
        "URL": "https://zh.wikipedia.org/wiki/所罗门的伪证",
        "类型": "维基百科"
      },
      {
        "标题": "豆瓣读书 - 搜索《所罗门的伪证》",
        "URL": "https://search.douban.com/book/subject_search?search_text=%E6%89%80%E7%BD%97%E9%97%A8%E7%9A%84%E4%BC%AA%E8%AF%81",
        "类型": "豆瓣"
      }
    ],
    "推荐视频": [
      {
        "标题": "B站搜索 - 《所罗门的伪证》作品解说",
        "URL": "https://search.bilibili.com/all?keyword=%E6%89%80%E7%BD%97%E9%97%A8%E7%9A%84%E4%BC%AA%E8%AF%81%20%E8%A7%A3%E8%AF%B4",
        "来源": "B站",
        "视频类型": "解说",
        "简介": "搜索《所罗门的伪证》相关的作品解读、剧情分析和作者介绍视频"
      }
    ],
    "发表年份": 2012,
    "大洲": "亚洲"
  },
  "故事视图": {
    "故事摘要": "中学生在圣诞节早晨发现同学坠楼身亡，警方判定为自杀。但一封告密信指控这是谋杀，于是学生们决定自己组织一场校内审判来查明真相。",
    "完整故事": "圣诞节的早晨，东京第三中学的学生们在校园里发现了二年级学生柏木卓也的尸体——他从教学楼的屋顶坠落身亡。警方经过调查，判定为自杀，因为柏木生前长期不上学，性格孤僻，有抑郁倾向。学校和家长都接受了这个结论，事情似乎就这样过去了。\n\n但不久后，学校收到了一封匿名告密信，信中声称柏木不是自杀，而是被三个同班同学——大出俊次、桥田佑太郎、井口充——谋杀的！信中详细描述了三人将柏木推下屋顶的过程。这封信在学校和家长中引起了轩然大波，虽然警方重新调查后仍然维持自杀的结论，但谣言已经传开，大出三人成为了众矢之的。\n\n更糟糕的是，紧接着发生了一系列悲剧：一个名叫森内惠美里的年轻女教师（她是柏木的班主任）因为被指责'没有关注到柏木的问题'而受到巨大压力，最终辞职；一个名叫三宅树里的女生（她是告密信的疑似作者）因为内疚和压力，在一次交通事故中受了重伤；而大出俊次的父亲（一个暴力的黑社会分子）也因为暴力事件被逮捕。\n\n在这种混乱的局面下，二年级的女生藤野凉子（她是一个聪明、正直、有领导力的学生）做出了一个惊人的决定：她要组织一场'校内审判'，由学生们自己来查明柏木之死的真相！她召集了一群同学，分别扮演检察官、辩护律师、法官和陪审员，要在暑假期间对这个案件进行一场正式的审判。\n\n这场校内审判得到了部分老师和家长的支持，也遭到了很多人的反对。但藤野凉子和她的同学们坚持了下来，他们开始了认真的调查：他们走访了柏木的家人、朋友、老师；他们重新检查了案发现场；他们甚至找到了一些被警方忽略的线索。\n\n随着审判的进行，真相逐渐浮出水面：柏木卓也确实不是自杀，但也不是被大出三人谋杀的。真相更加复杂和令人心碎——柏木是在与一个名叫神原和彦的男生（他是柏木唯一的朋友，也是一个转学生）在屋顶上发生争执时，意外坠落的。神原和彦因为从小被父母虐待（他的父母曾试图杀死他然后自杀，他活了下来但留下了心理创伤），对生命有着不同于常人的看法。那天晚上，柏木约神原到屋顶，说自己'想死'，神原在与他争执（神原试图阻止他）的过程中，柏木意外失去平衡坠落。\n\n神原因为害怕和内疚，没有说出真相，而大出三人则因为平时品行不好（他们确实经常欺负同学），成为了谣言的目标。告密信是三宅树里写的，她因为被大出欺负过，所以想借机报复，但她没有想到这封信会引发这么大的悲剧。\n\n在校内审判的最后，神原和彦站出来承认了真相，这场由学生们自己组织的审判，最终查明了警方和大人们都没有查明的真相。柏木的死不是谋杀也不是自杀，而是一场悲剧性的意外，但围绕这场意外的谎言、谣言和报复，却造成了更多的伤害。\n\n这部小说是宫部美雪的又一部百万字巨作，它通过一个中学生的死亡事件，深刻地探讨了校园霸凌、青少年心理、家庭教育、学校制度、以及'真相'与'正义'的复杂性。标题'所罗门的伪证'来自圣经——所罗门王是最有智慧的人，但他的智慧也可能被用来作伪证；小说用这个比喻来说明，即使是最聪明的人（包括大人、警方、学校），也可能因为偏见和利益而掩盖真相，而孩子们的'校内审判'则是对这种'伪证'的反抗。",
    "人物关系": "藤野凉子（学生/校内审判组织者）- 柏木卓也（死者）- 神原和彦（柏木的朋友/真相相关者）- 大出俊次（被指控者）- 三宅树里（告密信作者）- 森内惠美里（班主任）",
    "关键时间线": "圣诞节早晨发现柏木坠楼身亡 / 警方判定自杀 / 匿名告密信指控大出三人谋杀 / 森内老师辞职，三宅交通事故重伤 / 藤野凉子决定组织校内审判 / 学生们扮演检察官律师法官陪审员 / 暑假期间认真调查 / 发现柏木与神原的关系 / 审判最后神原承认真相 / 真相：争执中意外坠落，不是谋杀也不是自杀",
    "角色档案": [
      {
        "姓名": "藤野凉子",
        "身份": "二年级学生",
        "与案件关系": "校内审判组织者",
        "动机": "追求真相和正义",
        "关键行为": "组织学生校内审判，查明柏木之死真相"
      },
      {
        "姓名": "柏木卓也",
        "身份": "二年级学生/死者",
        "与案件关系": "受害者",
        "动机": "无（孤僻抑郁）",
        "关键行为": "在屋顶与神原争执时意外坠落"
      },
      {
        "姓名": "神原和彦",
        "身份": "转学生/柏木唯一的朋友",
        "与案件关系": "真相相关者",
        "动机": "内疚+害怕",
        "关键行为": "与柏木争执时发生意外，最终站出来承认真相"
      },
      {
        "姓名": "大出俊次",
        "身份": "二年级学生",
        "与案件关系": "被指控者",
        "动机": "无（平时霸凌同学）",
        "关键行为": "被诬告为凶手，承受巨大压力"
      },
      {
        "姓名": "三宅树里",
        "身份": "二年级女生",
        "与案件关系": "告密信作者",
        "动机": "报复大出",
        "关键行为": "写匿名告密信，引发一系列悲剧"
      },
      {
        "姓名": "森内惠美里",
        "身份": "年轻班主任",
        "与案件关系": "受害者（职业）",
        "动机": "无",
        "关键行为": "因被指责没有关注柏木而辞职"
      }
    ],
    "结局": "柏木卓也的死不是谋杀也不是自杀，而是与神原和彦在屋顶争执时意外坠落。神原因童年创伤对生命有特殊看法，在柏木说'想死'并争执时，柏木失去平衡坠落。神原因害怕内疚没有说出真相。大出三人因平时霸凌成为谣言目标，告密信是被大出欺负过的三宅写的报复信。学生们的校内审判最终查明了大人们没查明的真相。"
  },
  "设计视图": {
    "核心诡计简述": "集体谎言+谣言杀人+自我审判诡计：核心不是传统的犯罪诡计，而是一个关于'真相如何被掩盖和扭曲'的社会派推理。一个简单的意外坠落，因为当事人的沉默、霸凌者的刻板印象、报复者的诬告、以及大人们的逃避和偏见，被扭曲成了一场'谋杀案'，并引发了更多的悲剧。学生们组织的'校内审判'则是对这个'集体伪证'的反抗——他们用最原始、最真诚的方式，找到了被大人们掩盖的真相。",
    "诡计类型": [
      "叙述性诡计",
      "心理操控",
      "其他"
    ],
    "可复用机制": [
      "封闭空间",
      "多视角叙事",
      "限时破案"
    ],
    "信息差分析": "信息差在于柏木死亡当晚的真实情况。只有神原和彦知道真相，但他因为害怕和内疚而沉默。警方因为柏木的抑郁倾向而草率判定为自杀。告密信的作者三宅树里不知道真相，她只是根据自己的猜测和报复心理写了那封信。大人们（学校、家长、警方）因为各种原因（怕麻烦、怕担责、偏见）而不愿意深入调查。藤野凉子和同学们需要从层层谎言和偏见中，找到被掩盖的真相。",
    "红鲱鱼/误导": "最大的红鲱鱼是大出俊次三人——他们平时霸凌同学、品行恶劣、有暴力倾向，而且在柏木死亡当晚确实在学校附近出现过，这些都让他们看起来像是凶手。告密信的'详细描述'也让很多人相信了谋杀的说法。但实际上，他们与柏木的死毫无关系，他们只是成为了谣言和偏见的牺牲品。",
    "难度评分": {
      "线索密度": 4,
      "误导数量": 5,
      "诡计隐蔽度": 4,
      "综合": 4.3
    },
    "线索链": [
      {
        "线索编号": "C01",
        "线索内容": "告密信的描述过于详细但有矛盾",
        "线索类型": "关键线索",
        "指向结论": "告密者不知道真相",
        "出现时机": "中期"
      },
      {
        "线索编号": "C02",
        "线索内容": "大出三人案发时的不在场证明被忽略",
        "线索类型": "关键线索",
        "指向结论": "他们不是凶手",
        "出现时机": "中期"
      },
      {
        "线索编号": "C03",
        "线索内容": "神原和彦是柏木唯一的朋友",
        "线索类型": "关键线索",
        "指向结论": "他可能知道真相",
        "出现时机": "后期"
      },
      {
        "线索编号": "C04",
        "线索内容": "神原的童年创伤（父母杀他后自杀）",
        "线索类型": "背景信息",
        "指向结论": "他对生命有特殊看法",
        "出现时机": "后期"
      },
      {
        "线索编号": "C05",
        "线索内容": "三宅树里曾被大出霸凌",
        "线索类型": "关键线索",
        "指向结论": "告密信的动机",
        "出现时机": "中期"
      },
      {
        "线索编号": "C06",
        "线索内容": "屋顶的栏杆有磨损痕迹",
        "线索类型": "关键线索",
        "指向结论": "可能是争执时留下的",
        "出现时机": "后期"
      }
    ]
  },
  "游戏设计": {},
  "元数据": {
    "录入状态": "故事完成",
    "录入日期": "2026-08-31",
    "最后更新": "2026-08-31",
    "飞书记录ID": "",
    "版本": 1
  }
}