{
  "id": "case-089",
  "基本信息": {
    "案件名称": "愚者的片尾",
    "来源类型": "推理小说",
    "来源作品/事件": "冰菓系列",
    "作者/创作者": "米泽穗信",
    "地区": "日本",
    "年代": "日常推理（2000-至今）",
    "案件状态": "已破案",
    "一句话简介": "古典部的成员们被学姐邀请观看一部学生制作的悬疑电影，电影没有拍完，他们需要根据已有的线索推理出电影的结局和凶手。",
    "参考链接": [
      {
        "标题": "维基百科 - 愚者的片尾",
        "URL": "https://zh.wikipedia.org/wiki/愚者的片尾",
        "类型": "维基百科"
      },
      {
        "标题": "豆瓣读书 - 搜索《愚者的片尾》",
        "URL": "https://search.douban.com/book/subject_search?search_text=%E6%84%9A%E8%80%85%E7%9A%84%E7%89%87%E5%B0%BE",
        "类型": "豆瓣"
      }
    ],
    "推荐视频": [
      {
        "标题": "B站搜索 - 《愚者的片尾》作品解说",
        "URL": "https://search.bilibili.com/all?keyword=%E6%84%9A%E8%80%85%E7%9A%84%E7%89%87%E5%B0%BE%20%E8%A7%A3%E8%AF%B4",
        "来源": "B站",
        "视频类型": "解说",
        "简介": "搜索《愚者的片尾》相关的作品解读、剧情分析和作者介绍视频"
      }
    ],
    "发表年份": 2002,
    "关联作品": [
      {
        "作品名称": "冰菓",
        "作品类型": "小说",
        "关联关系": "同系列",
        "创作者": "米泽穗信",
        "简介": "米泽穗信古典部系列（冰菓系列）作品",
        "站内Slug": "推理小说/日本/冰菓"
      },
      {
        "作品名称": "库特莉亚芙卡的排序",
        "作品类型": "小说",
        "关联关系": "同系列",
        "创作者": "米泽穗信",
        "简介": "米泽穗信古典部系列（冰菓系列）作品",
        "站内Slug": "推理小说/日本/库特莉亚芙卡的排序"
      }
    ],
    "大洲": "亚洲"
  },
  "故事视图": {
    "故事摘要": "古典部的成员们被学姐邀请观看一部学生制作的悬疑电影，电影没有拍完，他们需要根据已有的线索推理出电影的结局和凶手。",
    "完整故事": "神山高中的古典部成员——折木奉太郎、千反田爱瑠、福部里志、伊原摩耶花——被二年级的学姐入须冬实邀请，观看一部由二年F班学生制作的悬疑电影。这部电影是为了学校文化祭而拍摄的，但拍摄过程中编剧（一个名叫本乡真由的女生）因为压力过大而病倒了，电影没有拍完，只拍到了发现尸体的部分，结局和凶手都没有确定。\n\n入须学姐希望古典部的成员们能够根据已有的电影内容和拍摄笔记，推理出本乡原本设想的结局和凶手，这样他们就能把电影拍完。折木奉太郎本来不想参与（他的信条是'不必要的事不做，必要的事尽快做'），但在千反田的好奇心和入须学姐的巧妙说服下，他还是加入了推理。\n\n电影的内容是：一群学生来到一座废弃的山庄（实际上是在学校的旧校舍拍摄的），他们在山庄里发现了一个被反锁的房间，撞开门后发现一个男生（海藤）被人用刀刺死在房间里，房间的窗户被钉死了，门是从内部反锁的，看起来是一个密室。电影只拍到这里，之后的内容没有拍。\n\n古典部的成员们开始了推理。福部里志从'诡计类型'的角度分析，认为这可能是一个密室诡计；伊原摩耶花从'拍摄细节'的角度分析，发现了一些道具和场景的矛盾；千反田爱瑠则从'编剧的心理'的角度分析，她觉得本乡真由不是一个会写残酷杀人故事的人。\n\n折木奉太郎在听取了大家的分析后，提出了自己的推理：他认为凶手是拍摄组的摄影师！因为在电影中，所有人都进入了山庄，只有摄影师留在外面拍摄，而密室的门实际上是从外部用某种道具（比如绳子和夹子）锁上的，摄影师是唯一有机会做到这一点的人。而且，摄影师在电影中从来没有露过脸（因为他是拍摄者），这是一个'叙述性诡计'——观众以为摄影师不存在，但实际上他就是凶手。\n\n入须学姐对折木的推理非常满意，她按照折木的推理把电影拍完了，电影在文化祭上放映后获得了好评。但折木后来发现，自己的推理可能不是本乡真由原本的设想——他从本乡的拍摄笔记和一些细节中发现，本乡原本设想的结局可能更加温和，甚至可能没有'凶手'（她可能想写的是一个意外死亡，或者是一个所有人都有责任的故事）。\n\n更重要的是，折木发现入须学姐从一开始就知道本乡的设想，但她故意没有告诉古典部的成员们，因为她想要一个'更精彩'的结局（本乡的结局太温和了，不适合文化祭的氛围）。她利用了折木的推理能力，让他'创造'了一个新的结局，而不是'推理'出原本的结局。\n\n折木对自己被利用感到愤怒，但他也意识到，自己的推理虽然不是本乡原本的设想，但它确实是一个合理且精彩的结局。千反田爱瑠则对折木说，她觉得本乡真由的原本设想可能更加重要——因为那是一个'没有凶手'的故事，而这样的故事在推理小说中是很少见的。\n\n这部小说是米泽穗信'冰菓系列'的第二部，它不仅仅是一个推理故事，更是一个关于'创作'和'解释'的故事。它探讨了一个深刻的问题：当一个作品没有完成时，后来者的'推理'到底是在还原作者的原意，还是在创造新的作品？标题'愚者的片尾'来自电影术语——'愚者'是指电影中那个看似愚蠢但实际上可能是关键的角色，而'片尾'则是指电影的结局。小说用这个比喻来说明，有时候最不起眼的角色（或者最不起眼的解释）可能才是真正的答案。",
    "人物关系": "折木奉太郎（主角/侦探）- 千反田爱瑠（古典部成员）- 福部里志（古典部成员）- 伊原摩耶花（古典部成员）- 入须冬实（学姐/委托人）- 本乡真由（编剧/病倒）",
    "关键时间线": "入须学姐邀请古典部观看未完成的悬疑电影 / 电影拍到密室发现尸体就结束了 / 编剧本乡病倒，需要推理结局和凶手 / 古典部成员从不同角度分析 / 折木推理出摄影师是凶手，利用叙述性诡计 / 入须按折木推理拍完电影，获得好评 / 折木发现自己被利用——入须知道本乡原意但想要更精彩的结局 / 本乡原本设想可能是'没有凶手'的温和故事 / 折木反思推理与创作的关系",
    "角色档案": [
      {
        "姓名": "折木奉太郎",
        "身份": "古典部成员/侦探",
        "与案件关系": "推理者",
        "动机": "被入须利用",
        "关键行为": "推理出摄影师凶手的结局，后发现被利用"
      },
      {
        "姓名": "千反田爱瑠",
        "身份": "古典部成员",
        "与案件关系": "提问者",
        "动机": "好奇心",
        "关键行为": "从编剧心理角度分析，关注本乡的原意"
      },
      {
        "姓名": "入须冬实",
        "身份": "二年级学姐",
        "与案件关系": "委托人/利用者",
        "动机": "想要精彩的电影结局",
        "关键行为": "故意隐瞒本乡原意，利用折木创造新结局"
      },
      {
        "姓名": "本乡真由",
        "身份": "二年F班编剧",
        "与案件关系": "原作者",
        "动机": "无（压力过大病倒）",
        "关键行为": "原本设想的是温和的、可能没有凶手的故事"
      },
      {
        "姓名": "福部里志",
        "身份": "古典部成员",
        "与案件关系": "分析者",
        "动机": "从诡计类型角度分析",
        "关键行为": "提供密室诡计的各种可能性"
      },
      {
        "姓名": "伊原摩耶花",
        "身份": "古典部成员",
        "与案件关系": "分析者",
        "动机": "从拍摄细节角度分析",
        "关键行为": "发现道具和场景的矛盾"
      }
    ],
    "结局": "折木推理出的结局是：凶手是电影中的摄影师（叙述性诡计——摄影师从未露脸，是唯一在山庄外的人），他利用道具从外部锁上密室的门。但这不是编剧本乡真由的原本设想。入须学姐从一开始就知道本乡的设想（可能是一个温和的、没有凶手的意外死亡故事），但她故意利用折木创造了一个更精彩的结局。折木发现自己被利用后感到愤怒，但也承认自己的推理是合理的。"
  },
  "设计视图": {
    "核心诡计简述": "作中作+叙述性诡计+被操控的推理诡计：核心是一个'未完成的推理作品'，侦探需要'推理'出作品的结局。但更深层的诡计是，侦探的推理实际上被委托人操控了——委托人想要的不是'还原原意'，而是'创造新结局'，她利用了侦探的推理能力来达到自己的目的。同时，电影中的'叙述性诡计'（摄影师是凶手，因为他从未露脸）也是一个经典的元推理诡计。这个故事探讨了推理小说本身的性质——推理到底是发现真相，还是创造真相？",
    "诡计类型": [
      "叙述性诡计",
      "密室",
      "其他"
    ],
    "可复用机制": [
      "封闭空间",
      "多视角叙事"
    ],
    "信息差分析": "信息差在于本乡真由的原本设想和入须学姐的真实目的。古典部的成员们（包括折木）都以为自己是在'推理'本乡原本的结局，但实际上入须学姐从一开始就知道本乡的设想，她只是想要一个'更精彩'的结局，所以她利用了折木的推理能力来'创造'新结局。折木需要从本乡的拍摄笔记、电影中的细节、以及入须学姐的行为中，发现自己被利用的事实。同时，电影中的'摄影师'也是一个信息差——观众以为摄影师不存在，但他可能就是凶手。",
    "红鲱鱼/误导": "最大的红鲱鱼是'密室诡计'本身——福部里志和伊原摩耶花都在专注于分析密室是如何形成的（窗户钉死、门反锁），他们假设这是一个传统的密室杀人案。但折木的推理跳出了这个框架，他发现'密室'的形成可能非常简单（从外部用道具锁门），而真正的诡计是'叙述性诡计'（摄影师是凶手）。入须学姐的'真诚'也是红鲱鱼——她看起来像是一个真心想要帮助同学完成电影的学姐，但实际上她在利用古典部的成员们。",
    "难度评分": {
      "线索密度": 4,
      "误导数量": 4,
      "诡计隐蔽度": 5,
      "综合": 4.3
    },
    "线索链": [
      {
        "线索编号": "C01",
        "线索内容": "电影中摄影师从未露脸",
        "线索类型": "关键线索",
        "指向结论": "叙述性诡计——摄影师可能是凶手",
        "出现时机": "中期"
      },
      {
        "线索编号": "C02",
        "线索内容": "密室的门可能从外部用道具锁上",
        "线索类型": "关键线索",
        "指向结论": "密室诡计的解法",
        "出现时机": "中期"
      },
      {
        "线索编号": "C03",
        "线索内容": "本乡的拍摄笔记中有很多'温和'的细节",
        "线索类型": "关键线索",
        "指向结论": "本乡的原意可能不是残酷杀人",
        "出现时机": "后期"
      },
      {
        "线索编号": "C04",
        "线索内容": "入须学姐对折木的推理过于满意",
        "线索类型": "关键线索",
        "指向结论": "她可能早就知道答案",
        "出现时机": "后期"
      },
      {
        "线索编号": "C05",
        "线索内容": "电影中的道具和场景有矛盾",
        "线索类型": "背景信息",
        "指向结论": "拍摄条件限制了诡计的可能性",
        "出现时机": "中期"
      },
      {
        "线索编号": "C06",
        "线索内容": "本乡因为压力过大而病倒",
        "线索类型": "背景信息",
        "指向结论": "她可能不喜欢写残酷的故事",
        "出现时机": "前期"
      }
    ]
  },
  "游戏设计": {},
  "元数据": {
    "录入状态": "故事完成",
    "录入日期": "2026-08-31",
    "最后更新": "2026-08-31",
    "飞书记录ID": "",
    "版本": 1
  }
}
