{
  "id": "case-082",
  "基本信息": {
    "案件名称": "点与线",
    "来源类型": "推理小说",
    "来源作品/事件": "松本清张作品",
    "作者/创作者": "松本清张",
    "地区": "日本",
    "年代": "社会派（1950-1970）",
    "案件状态": "已破案",
    "一句话简介": "一对男女在海边殉情，但刑警发现他们的车票和时间线存在微妙的矛盾，一场涉及政府腐败的谋杀逐渐浮出水面。",
    "参考链接": [
      {
        "标题": "维基百科 - 点与线",
        "URL": "https://zh.wikipedia.org/wiki/点与线",
        "类型": "维基百科"
      },
      {
        "标题": "豆瓣读书 - 搜索《点与线》",
        "URL": "https://search.douban.com/book/subject_search?search_text=%E7%82%B9%E4%B8%8E%E7%BA%BF",
        "类型": "豆瓣"
      }
    ],
    "推荐视频": [
      {
        "标题": "B站搜索 - 《点与线》作品解说",
        "URL": "https://search.bilibili.com/all?keyword=%E7%82%B9%E4%B8%8E%E7%BA%BF%20%E8%A7%A3%E8%AF%B4",
        "来源": "B站",
        "视频类型": "解说",
        "简介": "搜索《点与线》相关的作品解读、剧情分析和作者介绍视频"
      }
    ],
    "发表年份": 1957
  },
  "故事视图": {
    "故事摘要": "一对男女在海边殉情，但刑警发现他们的车票和时间线存在微妙的矛盾，一场涉及政府腐败的谋杀逐渐浮出水面。",
    "完整故事": "在九州的香椎海岸，一对男女被发现死在海滩上，看起来像是殉情自杀——男子是东京某机械公司的助理科长佐山宪一，女子是赤坂某高级餐厅的女招待阿时。两人都死于氰化钾中毒，身边放着掺了毒的橙汁。警方初步判断为殉情，因为佐山最近因为公司的贪污案被调查，可能是畏罪自杀。\n\n但老刑警鸟饲重太郎发现了一些疑点：两人的死亡时间和位置存在微妙的矛盾；他们乘坐的列车车票显示他们应该是在不同时间到达的；而且阿时的口袋里有一张从东京到九州的车票，但佐山的车票却不见了。更重要的是，鸟饲发现这对'情侣'实际上并不亲密——他们在列车上甚至没有坐在一起。\n\n与此同时，东京的刑警三原纪一也在调查这起案件，他注意到一个关键的时间点：在佐山和阿时死亡的当天，政府某部门的官员安田辰郎正好乘坐了同一班列车，但他在中途下车了，有完美的不在场证明。安田是佐山公司的生意伙伴，与政府的贪污案有密切关系。\n\n三原开始调查安田的不在场证明，他发现安田利用了日本复杂的铁路和航空网络，制造了一个看似完美的不在场证明。安田的诡计是：他先让佐山和阿时分别到达九州（他们以为是去执行不同的任务），然后在香椎海岸将两人毒杀，伪装成殉情。之后，安田利用飞机和列车的组合，在极短的时间内返回东京，出现在一个不可能的地方，制造了不在场证明。他甚至利用了一个'目击者'——让阿时在东京站的站台上被人看到与佐山'在一起'（实际上他们只是碰巧在同一个站台上，中间隔着13号车厢），制造了两人一起旅行的假象。\n\n真相是：安田辰郎是政府贪污案的核心人物之一，佐山知道太多内幕，安田需要灭口。阿时则是因为偶然看到了安田与佐山的秘密会面，被安田选中作为'殉情'的道具——这样佐山的死就会被解释为殉情，而不是灭口。安田的妻子亮子也参与了这个计划，她是一个聪明但病弱的女人，帮助丈夫设计了这个复杂的时刻表诡计。\n\n三原最终通过反复核对列车时刻表和飞行时间，识破了安田的不在场证明。但在逮捕安田之前，安田和亮子已经服毒自杀了，留下了遗书承认了罪行。政府的贪污案也因此被揭露，多名官员被逮捕。这部小说是日本社会派推理的开山之作，它不仅是一个精彩的时刻表诡计，更深刻地揭露了战后日本社会的腐败和黑暗。",
    "人物关系": "鸟饲重太郎（九州刑警）- 三原纪一（东京刑警）- 安田辰郎（凶手/商人）- 亮子（安田妻子/共犯）- 佐山（受害者/贪污案知情人）- 阿时（受害者/女招待）",
    "关键时间线": "香椎海岸发现男女殉情尸体 / 鸟饲发现时间线和车票矛盾 / 三原注意到安田的不在场证明 / 调查东京站13号车厢的目击证词 / 反复核对铁路和航空时刻表 / 识破安田的不在场证明诡计 / 真相：安田为掩盖贪污案杀人灭口 / 安田夫妇自杀，贪污案被揭露",
    "结局/真相": "真凶是安田辰郎，妻子亮子为共犯。安田是政府贪污案核心人物，为灭口知情人佐山，并利用偶然看到秘密会面的女招待阿时，将两人毒杀伪装成殉情。他利用日本复杂的铁路航空网络制造完美不在场证明，甚至利用东京站13号车厢制造两人一起旅行的假象。三原识破诡计时，安田夫妇已服毒自杀。",
    "角色档案": [
      {
        "姓名": "三原纪一",
        "身份": "东京刑警",
        "与案件关系": "调查者",
        "动机": "追求真相",
        "关键行为": "反复核对时刻表，识破不在场证明诡计"
      },
      {
        "姓名": "鸟饲重太郎",
        "身份": "九州老刑警",
        "与案件关系": "调查者",
        "动机": "对细节的敏感",
        "关键行为": "发现殉情案中的疑点，推动调查"
      },
      {
        "姓名": "安田辰郎",
        "身份": "商人/贪污案核心",
        "与案件关系": "真凶",
        "动机": "掩盖贪污罪行",
        "关键行为": "设计复杂时刻表诡计，杀人灭口后自杀"
      },
      {
        "姓名": "安田亮子",
        "身份": "安田的妻子",
        "与案件关系": "共犯",
        "动机": "帮助丈夫",
        "关键行为": "病弱但聪明，协助设计不在场证明，最后与丈夫一起自杀"
      },
      {
        "姓名": "佐山宪一",
        "身份": "公司助理科长",
        "与案件关系": "受害者",
        "动机": "贪污案知情人",
        "关键行为": "被安田毒杀灭口，伪装成殉情"
      },
      {
        "姓名": "阿时",
        "身份": "高级餐厅女招待",
        "与案件关系": "受害者",
        "动机": "偶然看到秘密会面",
        "关键行为": "被安田选中作为殉情道具"
      }
    ]
  },
  "设计视图": {
    "核心诡计简述": "时刻表不在场证明+殉情伪装诡计：核心是利用日本高度发达且精确的铁路和航空网络，设计一个复杂的不在场证明。凶手同时利用了'殉情'这个社会普遍接受的自杀形式，将两起独立的谋杀伪装成一起殉情，从而掩盖了真实的杀人动机（灭口）。东京站13号车厢的视觉错觉（两人在同一个站台但被车厢隔开，被误认为在一起）是这个诡计的关键细节。",
    "诡计类型": [
      "不在场证明",
      "时刻表",
      "叙述性诡计",
      "心理操控"
    ],
    "可复用机制": [
      "多视角叙事",
      "限时破案"
    ],
    "信息差分析": "信息差在于安田的真实位置和交通方式。所有人都相信安田在案发时在另一个城市，因为他有车票、有目击者、有完美的时间线。但三原发现，这个时间线只有在使用某种特定的交通组合（飞机+列车）时才成立，而安田刻意隐瞒了他乘坐飞机的事实。同时，'殉情'的假设让警方忽略了两个受害者之间没有真实感情关系的事实。",
    "红鲱鱼/误导": "最大的红鲱鱼是'殉情'本身——男女一起死在海滩上、有毒橙汁、佐山被调查的贪污案，都让殉情看起来非常合理。安田的'完美不在场证明'也是红鲱鱼，它让警方相信安田不可能作案，从而忽略了对他的深入调查。东京站13号车厢的目击证词也是精心设计的红鲱鱼。",
    "难度评分": {
      "线索密度": 5,
      "误导数量": 4,
      "诡计隐蔽度": 5,
      "综合": 4.7
    },
    "线索链": [
      {
        "线索编号": "C01",
        "线索内容": "两人在列车上没有坐在一起",
        "线索类型": "关键线索",
        "指向结论": "他们不是情侣",
        "出现时机": "前期"
      },
      {
        "线索编号": "C02",
        "线索内容": "佐山的车票不见了",
        "线索类型": "关键线索",
        "指向结论": "有人销毁了证据",
        "出现时机": "中期"
      },
      {
        "线索编号": "C03",
        "线索内容": "东京站13号车厢隔开了两人",
        "线索类型": "关键线索",
        "指向结论": "目击证词是视觉错觉",
        "出现时机": "中期"
      },
      {
        "线索编号": "C04",
        "线索内容": "安田在中途下车但有不在场证明",
        "线索类型": "关键线索",
        "指向结论": "他可能使用了飞机",
        "出现时机": "后期"
      },
      {
        "线索编号": "C05",
        "线索内容": "安田与政府贪污案有密切关系",
        "线索类型": "关键线索",
        "指向结论": "杀人动机",
        "出现时机": "中期"
      },
      {
        "线索编号": "C06",
        "线索内容": "亮子病弱但对时刻表非常了解",
        "线索类型": "背景信息",
        "指向结论": "她可能参与了设计",
        "出现时机": "后期"
      }
    ]
  },
  "游戏设计": {},
  "元数据": {
    "录入状态": "故事完成",
    "录入日期": "2026-08-31",
    "最后更新": "2026-08-31",
    "飞书记录ID": "",
    "版本": 1
  }
}