{
  "id": "case-027",
  "基本信息": {
    "案件名称": "蓝可儿事件",
    "来源类型": "真实案件",
    "来源作品/事件": "蓝可儿死亡事件",
    "作者/创作者": "",
    "地区": "欧美",
    "年代": "当代（1980后）",
    "案件状态": "悬案",
    "一句话简介": "2013年洛杉矶，加拿大华裔女生蓝可儿在塞西尔酒店电梯中行为诡异，后被发现死在酒店屋顶水箱中。",
    "参考链接": [
      {
        "标题": "维基百科 - 蓝可儿死亡事件",
        "URL": "https://zh.wikipedia.org/wiki/蓝可儿死亡事件",
        "类型": "维基百科"
      },
      {
        "标题": "Wikipedia - Death of Elisa Lam",
        "URL": "https://en.wikipedia.org/wiki/Death_of_Elisa_Lam",
        "类型": "维基百科"
      }
    ]
  },
  "故事视图": {
    "故事摘要": "2013年1月，加拿大华裔女生蓝可儿（Elisa Lam）独自前往美国加州旅行，入住洛杉矶市中心的塞西尔酒店（Cecil Hotel）。1月31日她与家人失联。2月13日，警方公布了一段蓝可儿在酒店电梯中的监控视频，她在电梯中行为异常，像是在躲避某人。2月19日，酒店客人投诉水压低和水有异味，维修人员在屋顶水箱中发现了蓝可儿的裸体尸体。案件被判定为意外溺水，但疑点重重，至今仍有争议。",
    "完整故事": "2013年1月26日，21岁的加拿大华裔女生蓝可儿（Elisa Lam）从温哥华独自前往美国加州旅行。她先到圣地亚哥，1月28日入住洛杉矶市中心的塞西尔酒店（Cecil Hotel）。\n\n塞西尔酒店是一家有历史的廉价酒店，曾发生过多起死亡事件，连环杀手理查德·拉米雷斯（夜行者）和杰克·恩特维格都曾在此入住。\n\n1月31日，蓝可儿与家人的日常联系中断。家人报警后，洛杉矶警方开始调查。酒店工作人员表示最后一次见到蓝可儿是1月31日，但她的行李还在房间里。\n\n2月13日，洛杉矶警方公布了一段2013年2月1日（实际时间戳有争议）凌晨的电梯监控视频。视频中蓝可儿行为异常：她走进电梯后按下所有楼层按钮，然后多次探头查看电梯外，似乎在躲避某人。她走出电梯后做出一些奇怪的手势和动作，像是在与人交谈，但视频中没有其他人。最后她离开电梯，电梯门开着一段时间后关闭。这段视频迅速在网上传播，引发全球关注。\n\n2月19日，塞西尔酒店的客人投诉水压低、水有异味和颜色异常。酒店维修人员爬上屋顶检查，在一个水箱中发现了蓝可儿的裸体尸体。尸体已经在水中浸泡了19天。\n\n警方调查发现：\n1. 蓝可儿有躁郁症（Bipolar Disorder），正在服用多种药物；\n2. 她的尸检显示没有外伤，没有性侵迹象，死因是溺水；\n3. 水箱的盖子是从内部关上的（或者盖子本来就没盖紧）；\n4. 屋顶是锁着的，但酒店员工和有经验的人可以通过消防通道进入。\n\n2013年6月，洛杉矶县验尸官办公室裁定蓝可儿的死因为'意外溺水'，躁郁症是 contributing factor。但这个结论引发了大量质疑：\n1. 她是如何在裸体状态下爬上狭窄的水箱梯子并进入水箱的？\n2. 水箱盖子是如何从内部关上的？\n3. 电梯中的诡异行为如何解释？\n4. 为什么她的衣服不见了？\n\n蓝可儿事件成为2013年最受关注的神秘死亡事件之一，被无数纪录片、播客和影视作品引用。2021年Netflix推出了纪录片《犯罪现场：塞西尔酒店失踪事件》，详细调查了案件，但没有得出新结论。案件至今仍有争议。",
    "人物关系": "蓝可儿（受害者）- 塞西尔酒店 - 洛杉矶警方（调查者）- 未知（是否有他人参与存疑）",
    "关键时间线": "2013年1月26日：蓝可儿到达洛杉矶，入住塞西尔酒店；1月31日：与家人失联；2月1日：电梯监控视频拍摄时间；2月13日：警方公布电梯视频；2月19日：尸体在屋顶水箱被发现；6月：验尸官裁定意外溺水；2021年：Netflix纪录片播出；至今：案件仍有争议",
    "结局/真相": "官方裁定为意外溺水，躁郁症是 contributing factor。但大量疑点未被解释，案件至今仍有争议，许多人相信有他杀可能。",
    "角色档案": [
      {
        "姓名": "蓝可儿",
        "身份": "加拿大华裔大学生，21岁",
        "与案件关系": "受害者",
        "动机": "无（有躁郁症）",
        "关键行为": "在电梯中行为诡异，后死在酒店屋顶水箱中"
      },
      {
        "姓名": "塞西尔酒店",
        "身份": "洛杉矶市中心廉价酒店",
        "与案件关系": "案发地点",
        "动机": "无",
        "关键行为": "酒店有黑暗历史，屋顶可通过消防通道进入"
      },
      {
        "姓名": "洛杉矶警方",
        "身份": "调查机构",
        "与案件关系": "案件调查者",
        "动机": "破案",
        "关键行为": "公布电梯视频，调查后裁定意外溺水"
      },
      {
        "姓名": "维修人员",
        "身份": "酒店维修人员",
        "与案件关系": "尸体发现者",
        "动机": "无",
        "关键行为": "因客人投诉水压问题爬上屋顶，在水箱中发现尸体"
      }
    ]
  },
  "设计视图": {
    "核心诡计简述": "案件的核心是'密室死亡'——受害者死在锁着的屋顶水箱中，看似不可能是他杀。电梯中的诡异行为增加了神秘感。官方解释是精神疾病导致的意外，但疑点在于进入水箱的方式和盖子的关闭。",
    "诡计类型": [
      "密室",
      "心理操控",
      "其他"
    ],
    "可复用机制": [
      "封闭空间",
      "死亡信息",
      "多视角叙事"
    ],
    "信息差分析": "警方掌握监控视频和尸检结果，但无法还原蓝可儿死亡前的最后时刻；公众被电梯视频引导，产生各种阴谋论；酒店的黑暗历史和塞西尔酒店的名声增加了神秘感。",
    "红鲱鱼/误导": "电梯中的诡异行为、酒店的黑暗历史、水箱的密室状态、蓝可儿的精神疾病，都构成了巨大的信息噪音，让真相更加模糊。",
    "难度评分": {
      "线索密度": 3.0,
      "误导数量": 5.0,
      "诡计隐蔽度": 4.5,
      "综合": 4.2
    },
    "线索链": [
      {
        "线索编号": "NO.039",
        "线索内容": "电梯监控视频中蓝可儿行为异常，按下所有楼层按钮，多次探头查看，做出奇怪手势",
        "线索类型": "关键线索",
        "指向结论": "她可能在躲避某人，或处于精神疾病发作状态，视频时间戳有被修改的痕迹",
        "出现时机": "前期"
      },
      {
        "线索编号": "NO.040",
        "线索内容": "尸体在酒店屋顶水箱中被发现，裸体，水箱盖子从内部关上（或未盖紧）",
        "线索类型": "关键线索",
        "指向结论": "她是如何爬上狭窄梯子并进入水箱的？盖子如何关上？这些疑点让意外溺水结论受质疑",
        "出现时机": "中期"
      },
      {
        "线索编号": "NO.041",
        "线索内容": "蓝可儿有躁郁症，正在服用多种药物，尸检显示没有外伤和性侵迹象",
        "线索类型": "背景信息",
        "指向结论": "精神疾病可能导致异常行为和意外死亡，但无法完全解释所有疑点",
        "出现时机": "后期"
      }
    ]
  },
  "游戏设计": {
    "游戏平台": [],
    "玩法类型": [],
    "核心玩法机制": [],
    "关卡结构": "",
    "玩家引导方式": "",
    "推理系统设计": "",
    "可复用游戏模板": []
  },
  "元数据": {
    "录入状态": "待录入",
    "录入日期": "2026-08-30",
    "最后更新": "2026-08-30",
    "飞书记录ID": "recvtL0xkLasTg",
    "版本": 1
  }
}