{
  "id": "case-048",
  "基本信息": {
    "案件名称": "魍魉之匣",
    "来源类型": "推理小说",
    "来源作品/事件": "魍魉之匣",
    "作者/创作者": "",
    "地区": "日本",
    "年代": "近现代（1900-1980）",
    "案件状态": "已破案",
    "一句话简介": "少女被火车撞后在医院神秘消失，连环分尸案接连发生，京极堂揭开了一个关于'匣中少女'的疯狂实验。",
    "参考链接": [
      {
        "标题": "维基百科 - 魍魉之匣",
        "URL": "https://zh.wikipedia.org/wiki/魍魉之匣",
        "类型": "维基百科"
      },
      {
        "标题": "豆瓣 - 魍魉之匣",
        "URL": "https://book.douban.com/subject/1080000/",
        "类型": "豆瓣"
      }
    ],
    "大洲": "亚洲",
    "推荐视频": [
      {
        "标题": "B站搜索 - 《魍魉之匣》作品解说",
        "URL": "https://search.bilibili.com/all?keyword=%E9%AD%8D%E9%AD%89%E4%B9%8B%E5%8C%A3%20%E8%A7%A3%E8%AF%B4",
        "来源": "B站",
        "视频类型": "解说",
        "简介": "搜索《魍魉之匣》相关的作品解读、剧情分析和作者介绍视频"
      }
    ],
    "发表年份": 1995
  },
  "故事视图": {
    "故事摘要": "1952年，东京。少女柚木加菜子被火车撞成重伤，被送进一家神秘的医院后神秘消失。与此同时，东京接连发生分尸案，受害者的肢体被装在盒子里丢弃。京极堂（中禅寺秋彦）在调查中发现，这两起案件都与一个名为'美马坂'的医生有关——他在进行一项疯狂的实验，试图将人的大脑保存在盒子里，实现'永生'。加菜子并没有死，而是被美马坂做成了'匣中少女'——只有头部和部分器官，被保存在一个机械盒子里。分尸案的凶手是一个被'魍魉'附身的男人，他因为看到了匣中少女而精神崩溃。",
    "完整故事": "1952年8月，东京。两个少女——柚木加菜子和楠本赖子——在深夜的火车站台聊天。加菜子不小心跌落站台，被进站的火车撞成重伤。她被紧急送往一家名为'美马坂近代医学研究所'的医院。\n\n这家医院非常神秘，位于偏远的山区，由一个名为美马坂幸四郎的医生经营。加菜子被送进医院后，她的家人（实际上是她的'姐姐'，但实际上是她的母亲）柚木阳子被告知加菜子正在接受特殊治疗。但几天后，加菜子在一个完全封闭的病房中神秘消失了。\n\n与此同时，东京接连发生了一系列离奇的分尸案。受害者的肢体被整齐地切割，分别装在盒子里，丢弃在不同的地点。第一个被发现的是一只手，然后是一条腿，然后是躯干。警方调查陷入僵局，因为找不到受害者的身份，也找不到作案动机。\n\n京极堂（中禅寺秋彦）在朋友关口巽和刑警木场修太郎的委托下，开始调查这两起看似无关的案件。随着调查深入，他发现了一个惊人的真相：\n\n1. 美马坂幸四郎是一个疯狂的科学家，他在进行一项名为'活体保存'的实验——将人的大脑和必要的器官从身体中取出，保存在一个精密的机械盒子里，通过人工循环系统维持生命，实现'永生'。\n\n2. 加菜子并没有死，也没有被绑架。她被火车撞成重伤后，美马坂将她的大脑和部分器官取出，做成了'匣中少女'——一个只有头部和部分器官的存在，被保存在一个机械盒子里。加菜子的'消失'，是因为她已经不再是一个完整的人，而是被装在了盒子里。\n\n3. 分尸案的凶手是一个名为久保竣公的作家。他在一次偶然的机会中，看到了美马坂的'匣中少女'（加菜子），被这种'极致的美'所震撼，精神崩溃。他开始模仿，将年轻女性杀害后分尸，试图自己制作'匣中少女'。他的行为被解释为'魍魉附身'——一种被超自然存在控制的状态。\n\n4. 更复杂的是，加菜子的身世也被揭开：她是阳子和她的父亲（一个著名的演员）乱伦生下的孩子。阳子为了保护加菜子，将她当成自己的妹妹抚养。美马坂的实验，实际上是阳子委托的——她想让加菜子'永远活着'。\n\n京极堂通过一场'驱魔仪式'，让久保竣公面对了自己的疯狂，也让美马坂和阳子面对了他们的罪行。最终，美马坂的研究所被关闭，久保竣公被逮捕，加菜子的'匣中少女'状态被终结（她被允许真正地死亡）。\n\n小说探讨了'什么是人'、'永生是否是祝福'、'美与疯狂的边界'等深刻主题。",
    "人物关系": "京极堂（中禅寺秋彦/阴阳师/侦探）- 关口巽（作家/助手）- 柚木加菜子（受害者/匣中少女）- 柚木阳子（加菜子的母亲/伪装成姐姐）- 美马坂幸四郎（疯狂科学家）- 久保竣公（作家/分尸案凶手）- 木场修太郎（刑警）",
    "关键时间线": "案发当晚：加菜子被火车撞伤，送进美马坂研究所；数日后：加菜子在密室中'消失'；同期：东京发生分尸案，肢体被装在盒子里丢弃；调查中：京极堂发现美马坂的永生实验和加菜子的匣中少女状态；驱魔仪式：久保竣公被揭穿，美马坂的罪行被揭露；结局：研究所关闭，加菜子被允许死亡",
    "角色档案": [
      {
        "姓名": "京极堂（中禅寺秋彦）",
        "身份": "旧书店老板，阴阳师，侦探",
        "与案件关系": "案件侦破者",
        "动机": "受朋友委托，对超自然现象的兴趣",
        "关键行为": "通过驱魔仪式揭穿久保竣公的疯狂，揭露美马坂的实验"
      },
      {
        "姓名": "柚木加菜子",
        "身份": "少女，匣中少女",
        "与案件关系": "受害者",
        "动机": "无（被做成匣中少女）",
        "关键行为": "被火车撞伤后被美马坂做成匣中少女，最终被允许死亡"
      },
      {
        "姓名": "美马坂幸四郎",
        "身份": "疯狂科学家",
        "与案件关系": "实验者",
        "动机": "实现人类永生",
        "关键行为": "将加菜子做成匣中少女，经营秘密研究所"
      },
      {
        "姓名": "久保竣公",
        "身份": "作家，分尸案凶手",
        "与案件关系": "凶手",
        "动机": "被匣中少女的美震撼，精神崩溃，试图复制",
        "关键行为": "杀害年轻女性后分尸，装在盒子里丢弃，最终被京极堂揭穿"
      }
    ],
    "结局": "加菜子被美马坂做成了'匣中少女'（只有头部和器官保存在机械盒子里），她的'消失'是因为她不再是完整的人。分尸案凶手是久保竣公，他因为看到匣中少女而精神崩溃，试图自己制作匣中少女。美马坂的实验是阳子委托的，目的是让加菜子永生。"
  },
  "设计视图": {
    "核心诡计简述": "核心诡计是'密室消失'的变体——受害者并没有消失，而是被做成了'匣中少女'，从一个完整的人变成了盒子里的器官。分尸案的诡计是'模仿犯罪'：凶手因为看到了极致的'匣中少女'而精神崩溃，试图复制这种'美'。整个案件用'魍魉'（日本传说中的妖怪）作为叙事框架，将疯狂和超自然混为一谈。",
    "诡计类型": [
      "密室",
      "身份诡计",
      "心理操控"
    ],
    "可复用机制": [
      "封闭空间",
      "连环案件",
      "多视角叙事",
      "死亡信息"
    ],
    "信息差分析": "读者和调查者都被'密室消失'和'分尸案'的表象误导；美马坂的实验是高度机密的，外界不知道'匣中少女'的存在；加菜子的身世（乱伦的产物）被家族掩盖；久保竣公的'作家'身份掩盖了他的疯狂。",
    "红鲱鱼/误导": "魍魉的传说、美马坂研究所的神秘氛围、加菜子的身世谜团，都让案件看似是超自然事件；分尸案的'随机'性掩盖了凶手的真实动机（模仿匣中少女）。",
    "难度评分": {
      "线索密度": 4.5,
      "误导数量": 5,
      "诡计隐蔽度": 5,
      "综合": 4.8
    },
    "线索链": [
      {
        "线索编号": "NO.105",
        "线索内容": "少女加菜子被火车撞成重伤后，在美马坂研究所的密室中神秘消失，东京同时发生连环分尸案，肢体被装在盒子里丢弃。",
        "线索类型": "关键线索",
        "指向结论": "加菜子被美马坂做成了'匣中少女'（只有头部和器官保存在机械盒子里），分尸案凶手是看到匣中少女后精神崩溃的作家",
        "出现时机": "前期"
      },
      {
        "线索编号": "NO.106",
        "线索内容": "美马坂幸四郎是一个疯狂的科学家，他在进行'活体保存'实验，将人的大脑和必要器官保存在精密的机械盒子里，实现'永生'。",
        "线索类型": "背景信息",
        "指向结论": "美马坂的实验是整个案件的核心，加菜子的'消失'是因为她不再是完整的人，而是被装在了盒子里",
        "出现时机": "中期"
      },
      {
        "线索编号": "NO.107",
        "线索内容": "分尸案凶手久保竣公在一次偶然中看到了匣中少女（加菜子），被这种'极致的美'震撼，精神崩溃，开始模仿制作匣中少女。",
        "线索类型": "关键线索",
        "指向结论": "久保竣公因为看到匣中少女而精神崩溃，杀害年轻女性后分尸，试图自己制作匣中少女，最终被京极堂揭穿",
        "出现时机": "终局"
      }
    ]
  },
  "游戏设计": {
    "游戏平台": [],
    "玩法类型": [],
    "核心玩法机制": [],
    "关卡结构": "",
    "玩家引导方式": "",
    "推理系统设计": "",
    "可复用游戏模板": []
  },
  "元数据": {
    "录入状态": "待录入",
    "录入日期": "2026-08-30",
    "最后更新": "2026-08-30",
    "飞书记录ID": "recvtL4NvNZimj",
    "版本": 1
  }
}